Username,Name,City,Job,Bio
anneselin,Anne Selin,Alingsås,Engineer, energy,Neque at quo corrupti nulla. Nam quis optio aspernatur veniam saepe vitae laborum eius. Officia officia vel animi repellat quibusdam aut rerum. Impedit qui nobis perferendis. Accusamus ipsam officiis autem minus suscipit.
doriswestman,Doris Westman,Eskilstuna,Biochemist, clinical,Error labore consequatur quibusdam ducimus laborum blanditiis occaecati. Natus fugiat eveniet itaque tempore veniam recusandae.
harrietöstling,Harriet Östling,Östersund,Archaeologist,Magni cum dicta tempore tempore iste vero. Error ipsum nobis expedita veritatis vitae nobis voluptas laudantium. Sapiente corrupti iste nesciunt deserunt. Illum qui iste ad repudiandae facilis quo. Laudantium sapiente optio illum facere esse.
vilhelmblomberg,Vilhelm Blomberg,Växjö,Civil engineer, consulting,Cum officia officia cupiditate libero quibusdam vel quos quasi. Veniam debitis vel dicta quibusdam dolor laudantium. Maiores maiores facere repudiandae quidem odio.
oloflindblad,Olof Lindblad,Nyköping,Metallurgist,Doloribus delectus ullam nisi ab. Quibusdam culpa recusandae sapiente commodi dignissimos. Dignissimos modi optio ratione. Sit quaerat autem earum laudantium.
mariabrahamsson,Mari Abrahamsson,Lidingö,Scientist, biomedical,A iure accusantium consectetur veritatis unde esse ea. Similique adipisci fugit praesentium totam nisi. Facere itaque sed debitis ipsum ipsum perferendis reprehenderit. Tempore accusamus illo necessitatibus sit cumque reprehenderit.
violahagström,Viola Hagström,Sundsvall,Financial adviser,Tempore magni similique quo eius iusto molestias. Quos minima deleniti voluptatibus officia voluptatem facilis facere. Dolorum accusamus eligendi ipsum sapiente. Eum autem soluta excepturi fugit et quisquam facilis eaque.
hilleviöberg,Hillevi Öberg,Trelleborg,Designer, multimedia,Accusamus eveniet asperiores hic dolor qui. Repudiandae molestiae placeat iusto a hic velit neque. Similique aliquid voluptatem aspernatur itaque tempora.
tyrasjölander,Tyra Sjölander,Borlänge,Politician's assistant,Ea optio earum odit. Enim recusandae nisi totam sint omnis tempore odit. Voluptatibus nesciunt qui reprehenderit. Omnis fuga odit porro eaque facilis maiores accusamus.
leifberg,Leif Berg,Kalmar,Engineer, agricultural,Commodi unde consequuntur blanditiis dignissimos asperiores laboriosam minima. Minus iste dolore labore qui laudantium nostrum dolore animi. Hic eum quasi doloremque.
viktoriasjölund,Viktoria Sjölund,Piteå,Physicist, medical,Enim aut porro unde. Sapiente reprehenderit architecto praesentium aperiam illum. Quasi mollitia sint unde eos.
ann-brittnorberg,Ann-Britt Norberg,Göteborg,Computer games developer,Voluptas reprehenderit commodi itaque distinctio in delectus doloribus. Quo nostrum iusto maiores eum voluptatibus suscipit accusamus. Odit tempore odit itaque soluta odio eveniet.
gerhardbörjesson,Gerhard Börjesson,Landskrona,Speech and language therapist,Repellat quisquam blanditiis doloremque eius molestias. Possimus nemo impedit voluptate libero eius. Asperiores ipsam nulla doloremque nemo optio cum. Amet ullam et incidunt dolor exercitationem debitis.
ellennordström,Ellen Nordström,Helsingborg,Legal secretary,Laboriosam natus excepturi eum quasi doloribus. Iste fugiat minima dolor quia. Minus autem voluptatibus veritatis optio quasi necessitatibus necessitatibus. Voluptate iure ullam magnam totam facilis fuga praesentium provident.
harryvon,Harry Von,Trelleborg,Community pharmacist,Nesciunt maxime error nihil perferendis explicabo modi tempora quod. Reiciendis officiis deserunt reiciendis rerum laudantium delectus at. Ipsam nostrum non vero exercitationem nesciunt maiores eveniet.
henninggren,Henning Gren,Örebro,Insurance underwriter,Modi repudiandae amet amet reprehenderit laboriosam. Odit quaerat suscipit quaerat at aperiam. Ad ut laudantium deserunt odio.
susanneniklasson,Susanne Niklasson,Karlskrona,Politician's assistant,Ullam tempore officiis nihil iusto velit occaecati ipsum. Accusamus cum tempore ipsam. Neque quo at enim quis saepe. Harum nisi reprehenderit fuga cumque eaque.
oskaråman,Oskar Åman,Linköping,Ambulance person,Delectus maiores culpa soluta commodi. Adipisci fuga quibusdam necessitatibus rerum natus maxime. Voluptates ipsum quam placeat eaque exercitationem enim recusandae.
frideborgottosson,Frideborg Ottosson,Jönköping,Warehouse manager,Aperiam qui deleniti repellat eaque. Similique perferendis rem perferendis eligendi. Nostrum delectus eligendi illum quasi minus adipisci aliquid. Sequi assumenda suscipit necessitatibus veniam soluta quis quae quae. Dolorem rerum consequatur maxime reiciendis nihil.
erlingwester,Erling Wester,Karlstad,Economist,Nulla autem maiores explicabo repellendus reiciendis deleniti. Odio quo a repudiandae incidunt. Molestiae deleniti soluta nostrum explicabo aperiam labore magnam molestias. Voluptatibus dolores ratione rem labore nostrum.
ludvigrisberg,Ludvig Risberg,Uddevalla,Landscape architect,Fuga atque ab aut facilis tempore. Eum possimus at debitis praesentium voluptatibus dolorem qui. Debitis nihil voluptates rem incidunt.
tureabrahamsson,Ture Abrahamsson,Umeå,Operations geologist,Laborum autem animi quod. Repellat dignissimos quae architecto ipsa dignissimos culpa. Consequatur quas sunt voluptates nihil laboriosam quidem minima voluptates. Odio dolor asperiores iste iusto perferendis quibusdam aliquid.
ovesköld,Ove Sköld,Motala,Trade mark attorney,Fuga alias veritatis quis quisquam harum harum recusandae. Ullam minima cumque recusandae praesentium vitae. Consectetur nisi necessitatibus recusandae.
esterwallgren,Ester Wallgren,Karlstad,Geneticist, molecular,Sed possimus aut asperiores itaque nostrum facere. Saepe quam delectus cum. Delectus delectus nesciunt vero.
rogernorman,Roger Norman,Borås,Media planner,Repellendus maiores quam accusamus. Veniam repellat expedita pariatur deleniti. In temporibus iste itaque sit. Voluptatem vero tenetur quae labore at eligendi ad.
dagmarsvantesson,Dagmar Svantesson,Borås,Engineer, drilling,Dicta fuga nihil perferendis accusantium autem veniam doloribus. Beatae eveniet officiis ipsa quo soluta. Similique harum nobis ullam nobis atque nostrum quasi.
jonasbrolin,Jonas Brolin,Södertälje,Cabin crew,Consequatur fugit nisi nemo. Eius expedita culpa porro reprehenderit totam nam temporibus dolorum.
håkangunnarsson,Håkan Gunnarsson,Trollhättan,Geneticist, molecular,Molestias fugiat incidunt perferendis accusamus non facere debitis. Temporibus voluptatibus inventore animi corporis commodi fugit. Exercitationem officia libero unde fugiat quia. Porro error totam perferendis deleniti.
toreholmberg,Tore Holmberg,Jönköping,Research scientist (life sciences),Quae sit officiis hic voluptatem doloremque suscipit. Eveniet corporis nulla ratione veniam reprehenderit unde sunt. Dolor dolorum odio illum ipsa necessitatibus. Sint molestias totam provident facilis aliquam. Vitae aliquam repudiandae provident voluptates asperiores.
filipwennberg,Filip Wennberg,Karlskrona,Consulting civil engineer,Sapiente eum ut pariatur odit corporis expedita suscipit. Eius labore quam doloremque harum. Repudiandae officiis nulla quibusdam labore ex praesentium dignissimos est.
sigridengberg,Sigrid Engberg,Landskrona,Quarry manager,Adipisci beatae voluptatum eius totam. Totam voluptate molestiae deserunt quidem beatae voluptatibus.
gunlindberg,Gun Lindberg,Trelleborg,Surveyor, commercial/residential,Non cum iste quidem. Illo porro beatae ipsa at. Consequatur enim quisquam natus cupiditate assumenda sed.
sigvardnordlund,Sigvard Nordlund,Motala,Programmer, systems,Ab nihil distinctio neque unde porro iure culpa. Eum rerum dolor temporibus nulla laboriosam. Harum nemo reiciendis eum illum. Modi laboriosam quasi laborum magnam. Quos reprehenderit maxime id itaque.
erlandlindblad,Erland Lindblad,Mölndal,Education officer, community,Officiis impedit ipsa eos. Maxime necessitatibus saepe porro incidunt suscipit cum. Cupiditate nesciunt sit occaecati distinctio eos sed. Voluptates tempore accusantium ipsa unde nesciunt.
sigridthorén,Sigrid Thorén,Karlskrona,Building surveyor,Nisi inventore iure accusantium libero incidunt eum. Hic ab optio exercitationem eos. Ut iste sunt mollitia dolores consequuntur suscipit blanditiis. Eaque neque dolorem iste iure illo aspernatur molestiae. In dolores libero ullam quasi velit vero.
gustafboman,Gustaf Boman,Umeå,Surgeon,Cumque dolore aliquid neque suscipit ut nesciunt necessitatibus. Ea commodi assumenda quasi. Quam temporibus qui itaque sequi numquam unde labore. Totam aliquid veritatis corporis.
eugeniasalomonsson,Eugenia Salomonsson,Borlänge,Conservator, furniture,Aperiam vero consequatur tempora accusantium veniam. Doloremque id ea voluptate officia minus harum. Totam animi tempore sunt voluptates magni inventore eos maxime.
juditharaldsson,Judit Haraldsson,Eskilstuna,Solicitor,Voluptatibus eius tempore voluptatibus earum rem. Debitis deserunt minima laborum eius corrupti dolores. Autem voluptates commodi deleniti earum laborum dolore et. Cum dolores magnam earum porro nesciunt laborum doloremque.
ivarfält,Ivar Fält,Karlskoga,Economist,Dicta dolores est tenetur ratione. Mollitia quia enim delectus laudantium distinctio inventore laboriosam. Est animi quae commodi. Suscipit cupiditate ipsam asperiores nemo.
johannesfors,Johannes Fors,Malmö,Building control surveyor,Beatae aut vero dolor velit perspiciatis. Assumenda amet rerum iure error at velit magni. Nisi laudantium quidem ad. Asperiores soluta aut illum eligendi.
jonnyhellqvist,Jonny Hellqvist,Umeå,Development worker, community,Omnis mollitia voluptatum quas iure in beatae tempore. Quos unde repellat quidem dignissimos vero tempora.
vilhelmjohnsson,Vilhelm Johnsson,Jönköping,Building control surveyor,Tempore nam quibusdam dicta nesciunt. In repudiandae repellendus doloremque asperiores. Temporibus ratione laboriosam ullam tenetur dicta tempore. Quia perspiciatis a tenetur.
majhultman,Maj Hultman,Karlskrona,Insurance broker,Ad odio ipsum maxime velit. Sed placeat optio vel ad ex. Assumenda reiciendis porro eos. Harum dolor magni officia necessitatibus.
johannesbodin,Johannes Bodin,Uppsala,Administrator, arts,Perspiciatis rem praesentium voluptatem in nam. Impedit at aliquam hic sapiente recusandae. Ipsum ab dolorum cum cupiditate porro ex saepe. Libero fugiat repellat quasi deserunt error.
torbjörnholmberg,Torbjörn Holmberg,Uddevalla,Tree surgeon,Quidem perferendis officia animi nisi aut nulla. Dolor quasi non itaque fugit quo amet quibusdam ea. Aspernatur doloribus quo quae maiores commodi perspiciatis deserunt. Natus quo minus dolores nisi itaque.
ottiliahellberg,Ottilia Hellberg,Södertälje,Consulting civil engineer,Corporis autem ducimus expedita adipisci provident voluptatibus. Error commodi quisquam magni quam pariatur. Exercitationem a cum unde porro. In minus optio nihil architecto amet impedit harum repellendus.
jonnymartinsson,Jonny Martinsson,Västerås,Public relations officer,Assumenda laborum quos velit nihil voluptates quos. Voluptates alias neque consectetur. Consequuntur illo provident reprehenderit molestiae dolor quas.
olleöberg,Olle Öberg,Skellefteå,Radiation protection practitioner,Explicabo cumque at delectus est aperiam suscipit. Commodi illum aliquid non cumque quos repudiandae. Magni aperiam magni tenetur temporibus. Architecto modi pariatur magnam culpa deleniti nobis ad.
ingewahlgren,Inge Wahlgren,Helsingborg,Television floor manager,Accusantium natus dolorum fugiat qui eligendi nemo. Nostrum voluptatum omnis dolorem. Molestias porro doloribus asperiores at.
bertawennberg,Berta Wennberg,Nyköping,Dance movement psychotherapist,Iure earum consequuntur unde saepe eius laborum enim. Nemo asperiores optio veritatis vitae.
edvardwallgren,Edvard Wallgren,Karlstad,IT sales professional,Id ipsam maiores quibusdam doloremque. Eum dignissimos exercitationem incidunt non earum error corrupti harum. Quae dicta fugit asperiores sed sunt suscipit.
karolinawikström,Karolina Wikström,Gävle,Higher education lecturer,Doloremque minima ratione numquam eligendi. Ratione necessitatibus rerum inventore voluptas voluptate explicabo. Dolorem animi pariatur eaque repudiandae. Inventore magni debitis labore qui consectetur at minus. Impedit labore quam odit sequi.
ingelasten,Ingela Sten,Halmstad,Politician's assistant,Aperiam architecto harum quidem commodi iste at. Fuga sed asperiores quisquam nemo libero quae commodi. Sed accusantium quas voluptatem quae optio.
evasvärd,Eva Svärd,Helsingborg,Geophysical data processor,Ipsa eligendi harum animi nesciunt sunt. Blanditiis itaque quae cupiditate mollitia. Sunt atque libero qui alias. Harum libero eaque reprehenderit harum eligendi. Repudiandae porro suscipit minima.
ann-mariåsberg,Ann-Mari Åsberg,Piteå,Administrator, education,Adipisci fuga recusandae ipsam ab iusto impedit modi. Soluta veniam amet magni sit tenetur accusantium. Corporis ad sequi nulla sequi porro sequi dicta. Voluptates modi quia corporis quas.
ragnhildsundkvist,Ragnhild Sundkvist,Karlskoga,Petroleum engineer,Porro assumenda repellendus beatae sequi sequi. Quos fugit illo cupiditate consequatur corrupti. Deleniti ab provident nobis deserunt sunt repellendus veniam.
ingegärdliljegren,Ingegärd Liljegren,Umeå,Land,Maxime quaerat nobis dolores eum accusamus perspiciatis voluptates aspernatur. Voluptas mollitia necessitatibus porro eveniet rerum. Eos voluptates sint dolore numquam. Repudiandae ab temporibus voluptatem voluptas ut veritatis.
rolfhenningsson,Rolf Henningsson,Göteborg,Investment analyst,Dolor quibusdam suscipit iure nesciunt. Quasi sunt dicta eum officiis aperiam quis velit. Atque molestiae laudantium assumenda minima aut exercitationem sequi voluptatem. Quas id vero tenetur modi fugiat repellendus quidem.
yngvetörnqvist,Yngve Törnqvist,Alingsås,Production assistant, television,Doloremque dignissimos praesentium accusamus porro id iure cupiditate accusantium. Corporis tempora nam sit vitae. Unde voluptate placeat beatae. Provident cupiditate quaerat quisquam ad ea nulla nulla unde. Praesentium saepe itaque unde temporibus quidem magni.
ceciliaholmberg,Cecilia Holmberg,Varberg,Music tutor,Cumque illum minima culpa tempora quia numquam et. Odit occaecati id ipsam atque.
charlottegrönberg,Charlotte Grönberg,Motala,Doctor, hospital,Officiis fugiat rerum rerum. Quisquam adipisci dicta quam. Suscipit recusandae dolorem nam neque ex porro laudantium. Culpa vel vero vitae sed quas.
sigurdnilsson,Sigurd Nilsson,Landskrona,Television camera operator,Odio itaque aperiam maxime ipsa sed ipsum nulla ex. Reiciendis accusamus nihil omnis. Magni ducimus nesciunt quis perspiciatis iusto alias. Sint libero accusantium accusantium eveniet nobis excepturi.
ann-marihellman,Ann-Mari Hellman,Motala,Engineer, automotive,Itaque minus qui tenetur autem explicabo amet. Ullam minus saepe hic provident. Facere molestias quia eos voluptatibus. Quidem architecto ex repellat dignissimos consequatur ex minus.
ottoholst,Otto Holst,Borås,Engineer, land,Necessitatibus quo perspiciatis aspernatur numquam dolorum. Sequi fugiat quod ducimus quibusdam amet totam adipisci. Recusandae aut explicabo perferendis totam. Sunt soluta sunt nemo.
georggabrielsson,Georg Gabrielsson,Kristianstad,Scientist, research (medical),Ipsum omnis consequuntur maiores. Qui voluptas ea provident illum tempore beatae tempore nostrum. Recusandae esse facere voluptas ab optio ullam.
almaengvall,Alma Engvall,Nyköping,Paramedic,Non qui facere dolorem eaque. Quae molestiae deleniti minus veritatis. Ipsam dolorum veniam quia dolore natus.
annieholmqvist,Annie Holmqvist,Linköping,Engineer, site,Cupiditate dolore possimus ad labore amet corporis sunt. Voluptas nihil minima tempora illo aut ducimus. Deleniti animi dolor quidem deserunt quia amet similique. Quisquam ut numquam et.
rogerholmberg,Roger Holmberg,Lund,Farm manager,Quos provident repellendus iure voluptatem dolor. Dolorum tenetur rerum quis deleniti eligendi dignissimos velit. Enim distinctio quisquam quibusdam eius veritatis tempora dolor.
göstarisberg,Gösta Risberg,Malmö,Doctor, general practice,Asperiores magnam deserunt nisi atque recusandae nihil dolorum. Libero architecto eum sint. Animi voluptatibus recusandae harum culpa.
peralmgren,Per Almgren,Stockholm,Banker,Totam culpa nulla perspiciatis harum nulla ullam placeat. Quos et labore voluptas explicabo corporis ab maxime. Molestiae esse quidem esse voluptates eaque.
rickardwikström,Rickard Wikström,Linköping,Exercise physiologist,Aut iure praesentium maxime enim quis hic eos. Sapiente debitis enim tempora est.
fritioffransson,Fritiof Fransson,Västerås,Sound technician, broadcasting/film/video,Praesentium quae porro numquam quisquam beatae ex facere saepe. Facere molestiae vel animi tempora laudantium repellat. Ab in sint quod quaerat ipsam. Unde neque dolore cum nihil perferendis reiciendis doloribus.
sonjarosenqvist,Sonja Rosenqvist,Sandviken,Teacher, adult education,Nisi sequi nostrum sed magnam cum. Blanditiis aliquid blanditiis dolores laborum explicabo. Quos officiis numquam adipisci molestias voluptatem esse mollitia eligendi.
elisesundström,Elise Sundström,Göteborg,Nurse, mental health,Possimus deserunt ratione esse autem placeat in. Illum a eaque corrupti fugit laudantium totam labore. Quia unde aut animi aspernatur hic sed omnis voluptatem.
dagnyaugustsson,Dagny Augustsson,Falun,Environmental health practitioner,Aliquid recusandae perferendis mollitia reiciendis totam animi architecto. Laborum quam quasi magni nulla. Repellat debitis amet cum ad odit laboriosam eius. Minus distinctio magni doloribus sint.
editholm,Edit Holm,Sundsvall,Amenity horticulturist,Error porro itaque repudiandae debitis nisi incidunt. Quis molestias laborum aspernatur aperiam vel. Velit amet porro magnam recusandae. Eius dicta soluta vel minima magni.
gullimalm,Gulli Malm,Karlskoga,Librarian, public,Harum nulla sunt porro aut nisi expedita. Cupiditate quasi esse corrupti rerum. Reiciendis ipsa minus asperiores nostrum sed vero. Fuga beatae ipsa consequatur expedita ipsum.
ingablomberg,Inga Blomberg,Varberg,Drilling engineer,Odio ab accusantium ad harum voluptate nesciunt inventore hic. Non inventore voluptatibus rerum optio. Expedita voluptatum voluptates esse nam mollitia. Optio distinctio officia inventore maiores numquam soluta sed aut.
ottiliabjörkman,Ottilia Björkman,Alingsås,Technical brewer,Doloribus blanditiis modi quidem minus. Excepturi sequi error dolores nesciunt. Facilis consequuntur aliquid iste atque hic error. Beatae aperiam deserunt aperiam modi mollitia voluptas.
eivorisraelsson,Eivor Israelsson,Helsingborg,Scientist, audiological,Laborum a pariatur impedit dolore rerum molestias eius. Repellendus quos recusandae fuga mollitia. Voluptate asperiores magni minima ullam necessitatibus reprehenderit labore. Beatae deleniti ipsam modi velit.
bertilhammarström,Bertil Hammarström,Stockholm,Barrister's clerk,Ut ratione commodi quasi corrupti consequuntur. Earum consequuntur quae enim enim a velit quibusdam. Exercitationem culpa voluptate voluptatem at.
natanaelenström,Natanael Enström,Luleå,Hydrologist,Quia aperiam velit voluptatibus iure voluptatem. Alias iusto delectus iste ea ut nesciunt earum. Architecto cumque quia numquam vitae vel. Esse perferendis dicta ut neque repudiandae.
britthedberg,Britt Hedberg,Östersund,Best boy,Laborum perferendis facere qui veniam ducimus vero dolores. Temporibus perspiciatis doloribus corporis vitae ipsum ex eos. Deserunt inventore rerum nisi deserunt officiis laborum consequuntur. Eius facere quod adipisci officia explicabo.
herbertberglund,Herbert Berglund,Lidingö,Civil Service administrator,Id nemo enim officiis facere quas natus. Quas vel temporibus in. Non minus aspernatur molestias culpa non unde voluptatum. Provident doloremque quibusdam repudiandae illo ipsum unde odio.
vilhelminabrolin,Vilhelmina Brolin,Sandviken,Financial adviser,Facere veniam eaque architecto minus dolor. Eligendi recusandae nemo maxime. Ducimus voluptatem quos temporibus magni beatae.
georgstenlund,Georg Stenlund,Östersund,Tourist information centre manager,Eaque at fugit sint iste quibusdam. Velit similique iure pariatur dicta vel dolorem porro. Harum neque voluptatibus quidem veritatis. Deleniti occaecati excepturi a facere fugiat. Modi autem dolorum autem quaerat consequuntur nam officia.
oveberntsson,Ove Berntsson,Mölndal,Designer, exhibition/display,Ipsa aliquam mollitia pariatur. Cumque illum necessitatibus velit iure aliquam. Ipsum reiciendis eligendi nobis in illum error sit animi.
ingegerdgabrielsson,Ingegerd Gabrielsson,Lidköping,Medical laboratory scientific officer,Assumenda provident voluptatibus occaecati voluptates blanditiis doloremque. Sapiente veniam sunt velit facilis soluta aut. Quas ad autem sunt fuga nobis. Hic excepturi ratione voluptatum odio ab.
haraldhammarström,Harald Hammarström,Motala,Therapist, music,Debitis minima architecto suscipit consectetur. Odio optio iure voluptate est quisquam optio hic. Animi dolorum ab veniam suscipit nesciunt.
jensivarsson,Jens Ivarsson,Sundsvall,Historic buildings inspector/conservation officer,Possimus sequi eos reprehenderit eveniet hic. Soluta quos veniam a quia. Asperiores veniam voluptates cumque error eligendi odit illum. Repellat vitae modi quis nisi esse.
majkenlindahl,Majken Lindahl,Landskrona,Designer, textile,Labore praesentium officiis necessitatibus nisi iste. Illum voluptatem blanditiis dignissimos nam vero.
margotadamsson,Margot Adamsson,Örebro,Colour technologist,Consequatur atque illum ex suscipit praesentium expedita rerum. Quam occaecati illo aliquid. Necessitatibus ab quo numquam ipsam. Nostrum eligendi facilis sequi animi alias praesentium.
marianasöderström,Mariana Söderström,Örnsköldsvik,Heritage manager,Explicabo iure saepe hic mollitia. Ea molestiae sed esse veniam. Dolore molestiae iste facilis cum.
anne-mariesvedberg,Anne-Marie Svedberg,Borlänge,Microbiologist,Maiores tempora debitis itaque. Voluptate aut incidunt fuga adipisci quis. Voluptates hic cumque veritatis ipsa perferendis nemo. Illo quos accusantium exercitationem tempore voluptates.
juliusnorström,Julius Norström,Jönköping,Psychotherapist,Beatae deleniti tenetur repellat ad alias. Commodi occaecati ipsam nesciunt quidem ipsam itaque fuga debitis. Saepe ipsum quibusdam quo omnis harum eligendi. Inventore qui asperiores quos officia.
danhammar,Dan Hammar,Borås,Telecommunications researcher,Culpa ducimus tempora accusamus impedit accusamus explicabo. Enim deleniti porro molestias eveniet laborum libero sunt. Aperiam quidem nesciunt mollitia reiciendis possimus illo eius.
göstasjöstedt,Gösta Sjöstedt,Trollhättan,Facilities manager,Recusandae praesentium exercitationem placeat dolor. Sunt tenetur similique unde veritatis consequuntur quo. Quidem aliquid neque perferendis cumque corrupti saepe ut. Dolorum non harum esse libero animi quasi.
axelahlqvist,Axel Ahlqvist,Sundsvall,Commercial art gallery manager,Eaque est error accusamus ea voluptatem earum voluptas distinctio. Earum perferendis debitis officiis nesciunt eum facere. Vel suscipit non facere cupiditate aperiam amet illum.
olaberg,Ola Berg,Lidingö,Investment analyst,Quos qui facere expedita error expedita sit animi. Asperiores dicta id eum consectetur veritatis adipisci assumenda. Tempora tempora delectus totam optio voluptates. Facere facilis dolorum eum expedita ad asperiores veritatis.
helmersöderberg,Helmer Söderberg,Karlskoga,Estate manager/land agent,Omnis nesciunt perferendis voluptatibus illo. Aperiam officia porro autem dolores vero ad porro perspiciatis. Ducimus iusto dignissimos delectus. Doloremque temporibus dolor modi dignissimos esse doloremque.
elofhedman,Elof Hedman,Örebro,Engineer, production,Nam excepturi sunt error repellendus. Sunt non minima veniam deserunt. Voluptatum eligendi saepe delectus modi.
violaroth,Viola Roth,Gävle,Dentist,Velit hic itaque culpa. Occaecati totam repellendus odio vero praesentium.
viktoreliasson,Viktor Eliasson,Örebro,Journalist, newspaper,Enim minus autem et ducimus. In dolores esse iure quam voluptate accusantium voluptatum vitae. Voluptatibus facere esse magnam possimus beatae temporibus unde ut.
johannaöstergren,Johanna Östergren,Karlstad,Osteopath,Id illum consectetur voluptatum eligendi aliquam. Odit voluptatum debitis facere neque voluptates officiis corrupti. Atque perferendis eligendi eos voluptatibus praesentium accusantium velit. Placeat amet voluptates natus ducimus mollitia cum libero delectus.
elinlund,Elin Lund,Helsingborg,Interior and spatial designer,Ipsa perspiciatis magni eaque perferendis perspiciatis voluptas reprehenderit. Nisi neque quia natus eius. Eius ullam accusantium perspiciatis autem minus laboriosam. Commodi sapiente perspiciatis libero ullam saepe repellat.
emilianordin,Emilia Nordin,Borlänge,Information systems manager,Facilis similique quasi cumque esse deserunt. Minima accusantium fugit maxime quis voluptatem sit eaque. Saepe nihil odit porro doloribus libero.
perwall,Per Wall,Ängelholm,Surveyor, land/geomatics,Consequuntur atque tempora consequatur dolore necessitatibus numquam. Eius ducimus ab nesciunt similique. Modi iure reprehenderit dicta distinctio ipsam tempora aspernatur. Accusamus architecto velit qui eveniet tenetur.
jeanetteberggren,Jeanette Berggren,Halmstad,Counsellor,Vero aperiam voluptatibus expedita molestias accusantium numquam. Modi consequuntur illum exercitationem deleniti quas commodi veniam. Veritatis sapiente tempora consectetur consequatur ut corrupti eveniet. Rem vero eaque mollitia.
irisliljegren,Iris Liljegren,Kristianstad,Patent attorney,Blanditiis nesciunt corporis voluptatem alias. Incidunt distinctio deleniti possimus perspiciatis ab excepturi fuga. Natus autem eveniet vero temporibus soluta.
