Username,Name,City,Job,Bio
sofiaalbinsson,Sofia Albinsson,Södertälje,Early years teacher,Magnam eligendi maxime minus vero. Fuga omnis laborum ipsa aliquid. Laboriosam esse ducimus doloremque recusandae totam quam.
ellahagman,Ella Hagman,Luleå,Research scientist (maths),Dicta necessitatibus quia explicabo magni quos asperiores unde. Repellat repellat eum eos neque perspiciatis impedit libero. Aliquam aspernatur earum hic.
beritericsson,Berit Ericsson,Jönköping,Translator,Impedit similique quo hic accusantium voluptas perferendis. Molestiae aperiam ullam ipsa accusantium deserunt eum.
olovpalm,Olov Palm,Lidköping,Producer, television/film/video,Velit sed eius assumenda quaerat soluta. Amet quod voluptates porro pariatur non voluptas debitis. Nihil ex voluptatem earum eius quidem.
sigridlöf,Sigrid Löf,Lidköping,Food technologist,Neque quia doloremque provident. Id consequatur ab rem voluptatem deserunt rem quas. Aspernatur nobis deleniti eligendi dicta facere amet eveniet.
mauritzöberg,Mauritz Öberg,Alingsås,Training and development officer,Officiis dolor doloremque neque aut explicabo eum. Dolorum quod sed quas quas adipisci ad necessitatibus. Dicta iusto nostrum delectus.
valborgrehn,Valborg Rehn,Skövde,Scientist, research (physical sciences),Hic vitae eius eius sed. Et expedita reiciendis nemo maxime voluptas pariatur suscipit. Fugiat aliquam eaque reprehenderit sit voluptate debitis distinctio. Expedita dignissimos non sint.
astridlindh,Astrid Lindh,Karlstad,Facilities manager,Recusandae fuga animi amet totam ea accusamus. Minima quibusdam blanditiis facere. Architecto cum eligendi mollitia. Ipsa sint fugiat esse quo quos totam aperiam similique.
alvarottosson,Alvar Ottosson,Trollhättan,Therapist, horticultural,Atque repellat dicta iusto ducimus delectus. Veritatis delectus quia fugit ipsam temporibus quisquam saepe. Quia molestiae sed minus beatae dolor placeat.
sörenkarlström,Sören Karlström,Norrköping,Product designer,Placeat minima voluptas nisi eaque. Magni deserunt inventore ducimus accusantium deserunt hic repellendus. Aliquid earum earum blanditiis dolore minima at. Ratione eum accusamus adipisci cum vero totam.
marieandrén,Marie Andrén,Alingsås,Engineer, mining,Voluptatem odit ea esse vel illo quisquam nemo nostrum. Temporibus autem harum exercitationem illum facilis voluptatum. Atque deleniti harum fugit sit.
albinsandgren,Albin Sandgren,Nyköping,Careers information officer,Expedita iusto quis aliquid accusantium nostrum quis. Sit eum officia aspernatur et illo maiores modi. Qui ab repellat corrupti molestiae occaecati.
wilhelmsöderqvist,Wilhelm Söderqvist,Södertälje,Psychologist, counselling,Beatae quae corporis neque quos deserunt dicta dolores. Blanditiis repellat quisquam repellat molestias cum nam sint. Provident vitae possimus tenetur. Cupiditate necessitatibus alias asperiores cum et.
jörgenhagberg,Jörgen Hagberg,Uddevalla,Paediatric nurse,Nemo voluptatum vero minima illum. Officia reiciendis quas consectetur. Itaque culpa quos vel sunt dolore. Veniam quae cupiditate officia debitis similique nihil.
monaerlandsson,Mona Erlandsson,Karlstad,Fitness centre manager,Recusandae laboriosam voluptate unde voluptates autem aperiam ex. Temporibus officia optio sint adipisci ipsam animi aut mollitia. Quasi laborum aliquid maxime vitae beatae.
margitjeppsson,Margit Jeppsson,Uppsala,Armed forces logistics/support/administrative officer,A maxime neque placeat unde ipsa sit eum ducimus. Fuga aliquid voluptatibus iste nihil pariatur. Eius nihil autem suscipit ipsa mollitia officiis soluta.
lailagranlund,Laila Granlund,Kristianstad,Designer, interior/spatial,Eligendi dicta facere minima magnam beatae. Commodi dolor magni odio harum. Illo iure magnam molestias eius. Ex quod quia minus totam. Vitae explicabo veniam nesciunt architecto quasi quo architecto corporis.
birgerpedersen,Birger Pedersen,Luleå,Fitness centre manager,Et ab atque quisquam porro inventore libero quibusdam. Ad itaque maiores ut tempora consequuntur. Incidunt veniam consectetur repellendus sed unde soluta commodi. Provident maiores dignissimos non eius. Tenetur est nobis rerum dolorum iusto nam.
gunneledman,Gunnel Edman,Lidingö,Freight forwarder,Totam vel fugiat accusamus rem voluptatibus sed illum. Molestias eveniet tempora quidem ducimus. Facilis minus libero quisquam occaecati saepe excepturi. Facilis ad ex voluptas.
michaelvestman,Michael Vestman,Örnsköldsvik,Special effects artist,Ut doloremque dolor tenetur labore. Odio quam in neque ipsam iure.
jörgenerlandsson,Jörgen Erlandsson,Kristianstad,Chiropodist,Voluptatum expedita a vitae doloribus itaque. Ducimus quae officia dolorum vero quis officia. Velit aut qui fuga impedit maxime minima.
margaretajonasson,Margareta Jonasson,Stockholm,Optician, dispensing,Inventore temporibus facilis eligendi eaque voluptates accusantium provident voluptatibus. Temporibus aliquam repudiandae tempore nulla dolore odit nisi. Adipisci eum sint dolorem quasi. Accusantium recusandae quasi vero quasi.
hedviglilja,Hedvig Lilja,Göteborg,Television floor manager,Quos facilis nam molestiae sint. Quisquam fuga animi unde ea necessitatibus delectus voluptas. Vero eveniet quidem tenetur perferendis reiciendis.
davidbengtsson,David Bengtsson,Kalmar,Social worker,Maxime doloribus sequi iste illum laudantium natus sunt voluptate. Qui nisi fuga voluptates hic repellendus. Eaque quod at nostrum incidunt. Beatae nam facere accusantium mollitia adipisci harum fuga. Reiciendis accusamus sit odio.
lars-eriköstlund,Lars-Erik Östlund,Motala,Wellsite geologist,Consectetur rem quis doloribus illum. Quidem vero dignissimos quasi animi impedit. Ipsam sit dolores non vero ipsa ipsum.
ann-mariezetterberg,Ann-Marie Zetterberg,Skövde,Programmer, systems,Quis voluptate repudiandae dolorum eligendi ullam. Fuga commodi temporibus labore cumque cumque dolores. Aspernatur aspernatur veniam quia sint hic et recusandae. Eos totam fugiat dicta veritatis nemo a quas quam.
henrikalm,Henrik Alm,Umeå,Dancer,Sunt praesentium iste doloremque accusamus voluptas repellat rerum. Consectetur aperiam aliquam sed quo. Molestiae quam architecto exercitationem sed perferendis.
sirilöfgren,Siri Löfgren,Jönköping,Catering manager,Voluptates odit dicta quaerat quae. Odio illum tempora nostrum quod eaque reiciendis. Cupiditate accusantium in possimus tenetur.
danielsalomonsson,Daniel Salomonsson,Luleå,Housing manager/officer,Aperiam fuga beatae alias modi eaque aspernatur. Eligendi laborum laboriosam numquam explicabo. Omnis fugit soluta eius molestias delectus quae doloribus.
monicabroberg,Monica Broberg,Borlänge,Editorial assistant,Autem nobis deleniti illum sed corrupti deserunt quibusdam eos. Voluptate atque quidem consequuntur maiores. Quod quasi recusandae corporis reprehenderit.
gunflink,Gun Flink,Luleå,Advertising account executive,Consequuntur nisi nihil cupiditate modi laborum rerum. Cumque quia possimus rem dolore quaerat perferendis. Pariatur molestiae adipisci non totam similique vero tenetur. Reiciendis in recusandae maxime.
jensedman,Jens Edman,Falun,Geneticist, molecular,Officia similique minus facilis laudantium. Quia voluptas dolorem omnis earum ducimus. Beatae error rem ratione ullam corrupti. Libero quas modi harum praesentium laudantium minus accusantium.
leifrobertsson,Leif Robertsson,Linköping,Research officer, political party,Eaque consectetur facere ex dicta. Quisquam corporis unde ratione. Magni saepe rem ut rerum totam porro ea.
elisabetåström,Elisabet Åström,Malmö,Accountant, chartered,Repellat at ex in rem sit expedita dolorem. Ducimus qui voluptate eveniet praesentium laboriosam reiciendis. Quam commodi ad delectus maiores. Modi recusandae eius odit assumenda cupiditate. Mollitia iste atque quidem harum magni tempore quidem.
elisabethsandell,Elisabeth Sandell,Helsingborg,TEFL teacher,Odio quo officiis modi alias quis. Velit ipsam perferendis ipsum maxime. Porro dolorem voluptatum harum esse. Distinctio sunt laudantium eum harum voluptatibus.
augustaborg,Augusta Borg,Stockholm,Architect,Odit quos illum laudantium. Adipisci ducimus id voluptatum. Id esse temporibus sequi expedita harum velit sit. Explicabo tempora aliquam nihil quo quam ducimus tempore quis.
connysvanberg,Conny Svanberg,Mölndal,Electrical engineer,Exercitationem vel sunt sunt vel. Ut eveniet quasi soluta.
eskilmalmgren,Eskil Malmgren,Piteå,Chemist, analytical,Fugiat optio maiores voluptatibus asperiores maiores sequi. Facere nam doloremque deserunt veniam. Saepe ab repellendus animi rerum. Doloremque amet culpa fuga quibusdam ipsam quidem.
arnoldlindskog,Arnold Lindskog,Stockholm,Applications developer,Enim reiciendis porro nobis libero. Voluptatibus mollitia praesentium sequi libero architecto. Error totam quod officiis doloremque adipisci eius.
elsiehögberg,Elsie Högberg,Nyköping,Copy,Consequuntur quidem earum quis in excepturi fugiat officia. Soluta earum saepe minus vitae. Atque dolorem officia aspernatur nobis impedit quo. Explicabo itaque est nam ullam itaque placeat nihil quasi.
hildurekholm,Hildur Ekholm,Karlskrona,Magazine journalist,Aut molestias reprehenderit quasi eveniet. Aliquid cumque necessitatibus at voluptatibus tenetur ea. Occaecati quibusdam ex itaque ab.
bennyaugustsson,Benny Augustsson,Halmstad,Town planner,Alias consequuntur expedita adipisci eius magni similique ratione. Temporibus alias officia impedit sint laboriosam pariatur. Perferendis nesciunt tenetur facilis aspernatur quidem animi.
helenolovsson,Helen Olovsson,Uddevalla,Geochemist,Suscipit neque quam nemo accusantium. Eius doloremque doloremque in. Laudantium nisi magni voluptate esse.
svantebergström,Svante Bergström,Stockholm,Holiday representative,Consectetur ducimus aut doloribus. Consequuntur iure laboriosam ducimus quas. Maxime laboriosam consectetur sed.
göstastenlund,Gösta Stenlund,Malmö,Engineer, technical sales,Molestias possimus reiciendis dolore. Pariatur nesciunt commodi optio non unde dolore iusto. Odit reprehenderit suscipit doloremque ipsam id corrupti occaecati.
hermaneinarsson,Herman Einarsson,Norrköping,Consulting civil engineer,Earum numquam exercitationem possimus adipisci assumenda repudiandae incidunt. Iste ullam sunt dignissimos animi ipsum placeat quae. Odit illo quia fugiat aut at.
kjellfredriksson,Kjell Fredriksson,Uppsala,IT consultant,Porro perspiciatis aut amet aliquid totam totam. Earum nihil corporis error possimus itaque iste odit dignissimos. Eos itaque soluta minus.
johanholst,Johan Holst,Mölndal,Company secretary,Dicta cupiditate nam possimus doloribus sit. Necessitatibus corporis necessitatibus eaque quam quod quaerat sunt porro.
josefforsgren,Josef Forsgren,Alingsås,Chiropractor,Natus velit tempora ea cumque ratione adipisci quibusdam. Ipsam praesentium commodi iure quod sed vel. Natus aperiam consequuntur iste amet atque doloribus.
davidhellman,David Hellman,Mölndal,Osteopath,Cumque qui repudiandae temporibus tempora veniam. Cum nesciunt quae consectetur doloremque.
verabengtsson,Vera Bengtsson,Östersund,Telecommunications researcher,Aliquam quo commodi quisquam pariatur optio voluptatum voluptate neque. Distinctio nemo impedit officiis iure dolores. Magni id aliquid placeat.
svenvesterlund,Sven Vesterlund,Borlänge,Scientist, research (medical),Illum laboriosam nisi temporibus fugit suscipit odio culpa. Sunt similique pariatur repellat nesciunt autem molestias. Earum odit unde dolor nihil cum molestiae occaecati voluptatem.
annikahedin,Annika Hedin,Lidköping,Secretary/administrator,Incidunt libero odit culpa quos nam itaque. Minus quos odio dolorem inventore. Porro temporibus debitis iste.
peteröstberg,Peter Östberg,Kristianstad,Conservator, furniture,Officia dignissimos est occaecati doloremque. Beatae aliquam consequuntur odio odio. Fuga laudantium veritatis natus eos et. Atque omnis reprehenderit fugit deleniti error quaerat. Voluptates occaecati dolor iure ea.
eivormolin,Eivor Molin,Lund,Commercial art gallery manager,Minus sint ut quibusdam inventore atque magni facere vero. Sed modi aperiam consectetur reiciendis dolores iusto. Nam possimus dolorum ullam tempora nobis consectetur.
emiliaknutsson,Emilia Knutsson,Karlstad,Armed forces training and education officer,Facere quibusdam possimus doloremque omnis. Odit a deserunt dignissimos nesciunt atque. Vero deleniti commodi voluptate asperiores aperiam.
elsasjölund,Elsa Sjölund,Uppsala,Dealer,Aut tempora hic necessitatibus distinctio perspiciatis id. Possimus amet natus enim quidem eligendi facilis. Cum fugit porro sequi explicabo perspiciatis. Deserunt quasi amet ad.
rolandisraelsson,Roland Israelsson,Uppsala,Advertising account planner,Quasi iste iste suscipit dolores iure sed. Provident asperiores voluptatibus distinctio tenetur recusandae cum error. Delectus incidunt enim voluptas ex voluptatem. Dignissimos ratione rem aliquam. Ullam consectetur maxime repellendus corporis.
ingegerdsjögren,Ingegerd Sjögren,Sandviken,Research scientist (life sciences),Vitae odit doloribus harum fuga ipsa in vel. Amet earum numquam voluptatum laboriosam et fugiat aperiam.
birgerahlqvist,Birger Ahlqvist,Gävle,Petroleum engineer,Minus doloremque soluta ab pariatur repellendus quod corrupti. Vitae molestias maiores ullam harum. Iste qui veritatis qui voluptatum sapiente. Mollitia exercitationem ratione pariatur atque qui nesciunt.
arturöstberg,Artur Östberg,Örnsköldsvik,Clinical embryologist,Adipisci exercitationem necessitatibus consectetur sed placeat a. Ab occaecati facilis dolore tempora est optio occaecati. Aliquid expedita doloremque ea.
eugeniadahlqvist,Eugenia Dahlqvist,Göteborg,Systems analyst,Explicabo illo ipsa saepe architecto sunt. Placeat provident facere cumque assumenda doloribus autem. Aliquid hic eligendi aperiam veritatis.
majkenåström,Majken Åström,Sandviken,Press photographer,Nostrum itaque soluta ipsam vel. Voluptatem quis deserunt aspernatur vitae voluptate dicta. Rerum autem quia totam quisquam maxime doloremque. Consectetur saepe tempore at sunt tenetur aut.
ingesjöholm,Inge Sjöholm,Karlstad,Office manager,Natus tenetur asperiores tenetur quae laborum neque ratione provident. Deleniti iusto eum voluptatem quod aliquam eum assumenda. Quos molestiae dicta facilis autem aliquid.
siriedlund,Siri Edlund,Karlskrona,Senior tax professional/tax inspector,Ab quos enim adipisci magni facere aliquam porro. Natus dignissimos tempore exercitationem dolore. Deserunt ex inventore et reiciendis expedita totam. Neque doloremque numquam cupiditate assumenda deleniti.
dagmarbylund,Dagmar Bylund,Mölndal,Engineer, manufacturing,Cum maiores placeat adipisci fuga ex veritatis in. Rem eveniet excepturi a veritatis deserunt eos tempora. Alias eligendi perspiciatis veniam officiis et. Autem nemo voluptatum beatae cupiditate itaque.
kennethpersson,Kenneth Persson,Trollhättan,Lawyer,Sit cumque enim consectetur quas. Assumenda culpa nesciunt quod. Cumque provident dolor eaque atque voluptatibus laborum harum. Tenetur quod in incidunt esse soluta ad omnis.
erlandnylén,Erland Nylén,Borlänge,Sub,Hic odio quo aut amet veniam reprehenderit eligendi. Eum eius adipisci sit quisquam laudantium commodi molestias. Corrupti hic quia at perspiciatis laborum cupiditate. Maiores odit sequi amet placeat nemo.
göranlevin,Göran Levin,Sundsvall,Nurse, learning disability,Sit ad dignissimos modi vitae deleniti harum autem. Provident suscipit unde similique delectus. Vero earum dolorem repudiandae quos mollitia. Nulla quidem reiciendis assumenda aspernatur quam.
alfridamoberg,Alfrida Moberg,Sundsvall,Publishing copy,Id sapiente suscipit excepturi non. Eveniet aspernatur eligendi aspernatur quas natus ratione perspiciatis. Accusantium illum autem officiis.
ingelasvanberg,Ingela Svanberg,Västerås,Quality manager,Error officiis repudiandae assumenda perferendis cupiditate blanditiis consectetur dignissimos. Tempora aperiam laudantium eveniet molestiae minima. Porro tempora quia fuga nulla.
kurtwennberg,Kurt Wennberg,Uddevalla,Museum education officer,Dolor tenetur deserunt expedita fugiat soluta quaerat sit. Autem consequuntur quas sed sit recusandae. Veniam error laboriosam voluptates nemo ipsum rem quod.
hildurlundquist,Hildur Lundquist,Göteborg,Engineer, manufacturing systems,Neque hic dolorum inventore deleniti tempore voluptate doloribus. Sit nobis aliquam ut provident sapiente ipsam ut rerum. Nobis vero maxime ab voluptate. Culpa tenetur doloribus est perferendis magnam perspiciatis aperiam vel. Delectus voluptate ipsa expedita labore distinctio.
svenhaglund,Sven Haglund,Trelleborg,Psychologist, occupational,Officia nesciunt nisi impedit mollitia accusamus. At rem vel ipsum rem sed. Tempora ipsum alias quis facere molestiae eius ad iusto.
harryturesson,Harry Turesson,Alingsås,Doctor, hospital,Asperiores laudantium quibusdam magni dolore nisi fugit. Minima vel cum nesciunt facilis est. Nisi assumenda quas labore. Dignissimos id libero voluptatem atque commodi eos optio. Adipisci sapiente repudiandae dolores tenetur id odit.
sörenhallin,Sören Hallin,Södertälje,Proofreader,Unde veritatis explicabo libero facilis laudantium natus error dolore. Est enim nulla deserunt voluptates a nemo. Occaecati amet reprehenderit minima excepturi nemo. Saepe ab repudiandae iure fuga officiis omnis veniam.
morganbäckman,Morgan Bäckman,Uppsala,Archaeologist,Sunt dolores commodi voluptatibus. Animi libero eligendi temporibus dolore blanditiis eum. Ad sit repellat temporibus minus aspernatur provident. Libero nihil ipsum quas nostrum eaque voluptatum. Est dolorem id placeat.
astridljungberg,Astrid Ljungberg,Lidköping,Horticultural therapist,Occaecati fugit rerum fuga fugit. Occaecati veritatis nostrum dignissimos maiores quo quis. Itaque porro culpa quas fuga a. Placeat corporis doloremque porro nulla.
elinmalmgren,Elin Malmgren,Borås,Network engineer,Asperiores architecto iste reprehenderit architecto aliquam. Labore rem explicabo neque quae hic rerum blanditiis. Accusantium deserunt voluptates quisquam laudantium impedit ad. Aperiam maxime sapiente cumque accusamus assumenda ipsum.
ingalindström,Inga Lindström,Göteborg,Medical laboratory scientific officer,Harum fugiat sunt quidem a porro. Explicabo harum quia odit ipsa neque exercitationem. Velit fugiat id quis odio et quas. Labore inventore sit adipisci magnam dolore vel velit perferendis.
tordögren,Tord Ögren,Skövde,Teacher, special educational needs,Quod vitae veniam architecto. Debitis suscipit esse debitis reprehenderit non facere consequuntur. Atque dolore perferendis expedita magnam in blanditiis. Porro temporibus quisquam illo aperiam molestias cumque blanditiis.
britasjöholm,Brita Sjöholm,Lidköping,Dentist,Molestias molestiae sapiente dolore ut reprehenderit culpa. Ullam perspiciatis vitae eligendi est. Consequuntur laborum voluptatum culpa voluptate cumque quis.
jeanettelidström,Jeanette Lidström,Uddevalla,Therapist, drama,Quisquam minima aspernatur praesentium nemo recusandae commodi. Fuga libero itaque sint sit at. Odio qui ullam ipsum tenetur optio qui. Esse accusantium minus veniam numquam quaerat.
göteengman,Göte Engman,Piteå,Event organiser,Possimus cumque atque earum ut vero. Enim magni quod excepturi harum odit.
charlottaolander,Charlotta Olander,Växjö,Surveyor, land/geomatics,Laudantium doloribus amet deleniti alias dolorem animi laboriosam. Cumque nostrum et hic veniam. Consequuntur enim minima odio vero. Saepe possimus temporibus commodi tenetur minima occaecati.
inezelofsson,Inez Elofsson,Kalmar,Video editor,Tempore mollitia eos officia similique. Quod recusandae vitae itaque nam quo vitae. Ipsa optio repellat quibusdam facere. Quis libero iure ipsa eveniet. Optio quaerat dolor facilis cupiditate assumenda.
solveigsvedberg,Solveig Svedberg,Växjö,Holiday representative,Accusamus quibusdam labore fugit impedit. Dignissimos dolores repellendus ea. Nesciunt animi nihil mollitia. Sit fuga accusamus in magni iusto explicabo doloribus veritatis.
gudrunstrandberg,Gudrun Strandberg,Kalmar,Barrister's clerk,Fugit dicta similique ipsa occaecati ipsum amet. Repellendus dolores facilis reprehenderit fugiat explicabo. Suscipit consequuntur labore itaque quae blanditiis quam.
martinwikström,Martin Wikström,Nyköping,Dance movement psychotherapist,Reiciendis exercitationem delectus eius itaque placeat fuga fuga corrupti. Expedita nulla cupiditate rem recusandae sint temporibus tempora. Assumenda id ad rem et dolorem adipisci.
elsyblom,Elsy Blom,Helsingborg,Phytotherapist,Rem provident vitae repudiandae. Error modi occaecati architecto accusamus tempore aliquid tempora qui.
johnwahlberg,John Wahlberg,Karlskoga,Podiatrist,Error autem explicabo rerum tenetur omnis accusamus. Nam optio maxime amet vel repudiandae atque qui. Harum consequuntur nihil inventore modi.
teodorsödergren,Teodor Södergren,Kristianstad,Education officer, environmental,Quos nulla accusantium modi ex maiores repellendus alias doloribus. Nam fuga similique labore placeat beatae maxime expedita enim. Repudiandae quae harum earum.
amaliasjölander,Amalia Sjölander,Lund,Press sub,Dolorum voluptatem incidunt soluta omnis. Illum fuga necessitatibus ipsam eos. Perspiciatis omnis officiis odio sapiente quibusdam.
albertnorrman,Albert Norrman,Stockholm,Fisheries officer,Laudantium aut vel veritatis soluta. Incidunt quos laboriosam quam earum. Ipsum necessitatibus magni vitae consequuntur vero. Delectus atque recusandae est sapiente rerum ex quas.
larshellman,Lars Hellman,Karlskoga,Telecommunications researcher,Rerum voluptatum iste soluta quae impedit voluptatibus voluptatem earum. Exercitationem optio occaecati velit dolor enim tempora at labore. Temporibus asperiores molestiae quis sapiente asperiores quis magni. Maxime veniam harum dolor nulla sint magnam. Velit saepe eveniet voluptates dignissimos ad quasi.
christervikström,Christer Vikström,Alingsås,Fine artist,Non harum magnam nulla culpa minus. Vitae iste vitae repudiandae. Saepe mollitia quod ab perferendis porro dicta nesciunt. Pariatur omnis quaerat laborum expedita ullam.
sunesimonsson,Sune Simonsson,Västerås,Pension scheme manager,Architecto fugit perferendis sit maxime quibusdam eos praesentium. Est nam harum labore assumenda iusto alias. Amet quos consequatur deserunt porro. Quia eius delectus nisi eaque.
sylvialövgren,Sylvia Lövgren,Karlstad,Teacher, special educational needs,Distinctio molestias asperiores perspiciatis officiis debitis esse. Occaecati repellat voluptatum inventore labore at. Iusto quam exercitationem asperiores inventore deleniti ad. Expedita quam tempora corrupti similique officia cum.
hermanlundberg,Herman Lundberg,Östersund,Building surveyor,Reprehenderit culpa officia quis dolorum cupiditate. Impedit dolor eum saepe. Deleniti numquam eius tempora architecto id similique iure ipsa. Aliquid sunt sunt ratione est molestiae corrupti hic.
ulrikaögren,Ulrika Ögren,Örebro,Arboriculturist,Aperiam modi assumenda facere aliquid. Incidunt molestiae nihil ea aliquam labore vero nisi.
lillemorbolin,Lillemor Bolin,Uppsala,Horticulturist, commercial,Iusto in ex doloribus beatae. Dicta et sapiente odit dolores molestiae. Corporis animi expedita odio laborum facere numquam ipsa. Praesentium amet ea voluptatem vero illo.
bonorlin,Bo Norlin,Helsingborg,Fish farm manager,Molestiae iusto velit ut modi. Ut atque ipsa itaque accusamus explicabo. Officia fuga similique hic exercitationem similique tempora eaque.
gustavsimonsson,Gustav Simonsson,Skellefteå,Field seismologist,Non omnis ad dolorum mollitia est qui quasi. Ipsam atque fugiat eius animi dicta reiciendis. Rem maxime vel quae et quae nostrum cum quis.
allanlundmark,Allan Lundmark,Lidingö,Research scientist (medical),Deserunt deleniti odit voluptatibus cupiditate. Sapiente aliquid nisi quis quidem. Nihil commodi voluptatem aspernatur at voluptate dolores.
agnesoskarsson,Agnes Oskarsson,Trelleborg,Psychologist, prison and probation services,Quisquam quidem quam debitis. Voluptatem deserunt libero doloribus architecto. Aspernatur officiis ad laborum adipisci est provident accusantium.
rudolfahlqvist,Rudolf Ahlqvist,Örnsköldsvik,Microbiologist,Eligendi expedita accusantium quo beatae corrupti. Iusto totam aperiam distinctio veritatis ad eos vitae. Exercitationem dolores necessitatibus laboriosam iusto.
haraldhultgren,Harald Hultgren,Lund,Industrial buyer,Labore unde voluptate similique perferendis accusamus. Illo placeat voluptas sit ab. Illum minus vitae libero sequi magni ab hic. Labore eius fugiat ducimus perspiciatis commodi quasi deleniti.
valdemarmårtensson,Valdemar Mårtensson,Landskrona,Statistician,Nemo fugiat aperiam facilis quas ab minus deserunt. Minus quam cumque illum impedit unde. Nisi consectetur eos quibusdam iusto aliquam. Eligendi mollitia nihil placeat.
violaholmberg,Viola Holmberg,Uppsala,Surveyor, mining,Saepe odit iure fuga possimus unde sit. Repudiandae corrupti architecto sit. Quidem quam repudiandae molestias consequatur quo suscipit pariatur. Nostrum aliquam alias id labore dolorum labore.
ingathulin,Inga Thulin,Örebro,Therapist, nutritional,Sequi dicta nostrum dolore odit quae nobis. Eaque incidunt laudantium esse distinctio. Sequi quam ipsum iure veniam.
adolfbäckström,Adolf Bäckström,Stockholm,Physiotherapist,Numquam vero officia culpa. Debitis numquam facere sed ratione dignissimos reprehenderit nostrum cum. Cupiditate quidem tenetur perferendis.
evabackman,Eva Backman,Karlskoga,Rural practice surveyor,Quis neque porro tempore placeat aspernatur neque hic. Iusto eos unde corrupti rerum velit dignissimos incidunt voluptas. Dolores ad id adipisci fugit.
eivorsöderström,Eivor Söderström,Örebro,Immigration officer,Hic beatae atque sit sunt ea praesentium odio. Cupiditate quas nesciunt maiores neque. Qui totam corporis veritatis. Accusantium itaque rem vitae porro voluptates aliquam.
