Username,Name,City,Job,Bio
jörgenögren,Jörgen Ögren,Nyköping,Orthoptist,Nostrum molestiae officia quidem nulla sunt quis sed. Officiis facere nobis alias impedit tempora. Doloribus repellat impedit cum nesciunt veritatis quis.
wilhelmhedström,Wilhelm Hedström,Östersund,Commissioning editor,Provident ut doloribus veniam exercitationem et ipsum maxime. Itaque non maiores ad delectus.
piastorm,Pia Storm,Jönköping,Forensic scientist,Fugiat doloribus laudantium beatae impedit accusamus nam recusandae. Nemo molestias fugit consequatur. Veniam quam aliquid modi necessitatibus. Eum et inventore culpa esse.
rogeralbertsson,Roger Albertsson,Stockholm,Merchandiser, retail,Ducimus iste ad accusantium dolor atque doloribus cupiditate quos. Nostrum nihil dignissimos similique recusandae. Voluptatibus sint quos facilis odit. Nesciunt alias quos quam totam commodi doloremque hic. Sint exercitationem natus maiores molestias cumque tenetur animi.
herbertbergsten,Herbert Bergsten,Luleå,Building surveyor,Consequuntur sequi odio maxime. Iure voluptatum quibusdam non corporis tempore.
janlevin,Jan Levin,Göteborg,Designer, fashion/clothing,Veritatis earum voluptate eligendi mollitia reprehenderit illo voluptas. Adipisci reiciendis maiores modi voluptates accusantium quae. Et nisi ipsam ipsa placeat.
margaretalindström,Margareta Lindström,Lund,Stage manager,Nisi vero illo quasi eum repudiandae minima. Porro sequi numquam ea optio minus provident. Adipisci alias blanditiis consectetur officia. Quae ut fugit sit ad unde.
sveabohlin,Svea Bohlin,Karlstad,Therapist, drama,Illo impedit sequi occaecati neque minima quo. Provident amet magni earum consequatur commodi iusto. Natus voluptates quae hic doloribus assumenda aliquid eligendi. Iure repellat atque distinctio cupiditate quae.
gunboström,Gun Boström,Varberg,Pilot, airline,Quo impedit iusto molestias distinctio a assumenda. Iure ipsa expedita labore quisquam. Nulla sapiente adipisci dicta voluptate eos.
klarahansson,Klara Hansson,Örebro,Broadcast engineer,Sint modi sapiente alias delectus sunt. Numquam perspiciatis itaque ad porro debitis laboriosam cumque. Tempore ut qui odio est provident illo. Porro vel facere optio at facilis accusantium.
teresiakvist,Teresia Kvist,Borås,Restaurant manager,Ducimus saepe alias numquam unde veniam. Animi sed ipsam nihil officia. Tempora in ex quia maiores. Aspernatur eius rem totam vel amet.
margarethalundqvist,Margaretha Lundqvist,Norrköping,Chiropodist,Consectetur debitis non accusantium occaecati. Quasi iure eum voluptates laborum incidunt assumenda.
olofsjölund,Olof Sjölund,Linköping,Education officer, museum,Rerum repudiandae optio dignissimos sapiente. Architecto dolore est eum similique totam. Atque facilis tempora non veniam a quos. Maxime dignissimos aliquid labore eius quisquam culpa distinctio.
helgaasp,Helga Asp,Örebro,Pathologist,Dolore incidunt at dolores. Placeat earum mollitia officia corrupti hic quam natus. Neque excepturi dolore soluta earum molestias quam. Recusandae deserunt ratione tempora doloremque.
camillaandrén,Camilla Andrén,Helsingborg,Information systems manager,At earum est voluptatum eos unde fugiat maiores. Quo aperiam quisquam rerum. Optio reiciendis omnis occaecati suscipit possimus ipsum harum. Ipsum pariatur similique non et magnam praesentium cupiditate. Veritatis animi repellat cumque ad dicta.
eliseenglund,Elise Englund,Kalmar,Marketing executive,Illo nihil voluptatibus corporis molestiae. Sed fuga nesciunt cumque voluptates enim dolor sapiente aliquam. Perspiciatis aperiam rerum perferendis illum possimus nam dolorem. Sapiente accusamus facere asperiores placeat alias mollitia.
nilsdahlström,Nils Dahlström,Ängelholm,Geologist, engineering,Quibusdam ducimus architecto laboriosam minima quidem ipsum quis vitae. Incidunt accusantium odit dolorum provident. Neque aperiam tenetur aspernatur quis sapiente quod.
erikfranzén,Erik Franzén,Örebro,Geochemist,Nulla tempore doloribus at soluta vel. Sunt ipsum facere quis autem sequi architecto sequi.
sixtenöman,Sixten Öman,Västerås,Higher education lecturer,Delectus praesentium voluptate suscipit ex. Assumenda nulla repellat quas quas cum odio ex asperiores. Soluta eos nemo porro autem. Saepe temporibus iure itaque ducimus.
kentbrolin,Kent Brolin,Sandviken,Teacher, primary school,Distinctio amet sint repellendus non dolorum. At enim delectus inventore eaque. Omnis aperiam distinctio vel officia fugiat eos culpa.
monamelin,Mona Melin,Kristianstad,Broadcast journalist,Cupiditate quidem est laboriosam deserunt nemo. Aut aut corrupti iure doloribus explicabo cumque provident quibusdam. Asperiores facilis omnis expedita laboriosam. Quam perspiciatis ipsum temporibus quisquam at. Doloremque omnis culpa dignissimos.
katarinaivarsson,Katarina Ivarsson,Karlskrona,Musician,Dicta a error minima ullam ipsum laboriosam sint consequatur. Repudiandae optio sint nostrum quas unde. Ad tempora eligendi reiciendis minus aliquam praesentium.
eleonorasimonsson,Eleonora Simonsson,Linköping,Chartered loss adjuster,Tempore officia odit ducimus veniam et quisquam. Optio unde voluptates quibusdam consectetur laboriosam. Distinctio architecto quae quisquam.
hildurbjörk,Hildur Björk,Kristianstad,Plant breeder/geneticist,Earum officia fugit possimus sequi libero repellat. Sint numquam esse voluptas cumque. Laborum possimus modi enim esse. Cupiditate quibusdam quo vitae sit consectetur ex autem.
juditlindahl,Judit Lindahl,Karlskrona,Dance movement psychotherapist,Exercitationem repudiandae architecto commodi velit tempora quasi fuga. Sed eius autem eaque. Nihil porro vel quidem distinctio omnis.
gerhardnygren,Gerhard Nygren,Skövde,Therapist, horticultural,Alias perspiciatis cum eum aliquam officia magnam. Doloribus asperiores aliquid in accusamus iusto. Modi voluptas ab nesciunt.
eriknorberg,Erik Norberg,Sandviken,Engineer, aeronautical,Officiis modi expedita placeat odit enim ducimus modi. Aperiam quod nostrum neque illo. Dicta eaque ratione laboriosam quaerat deleniti blanditiis vero. Repellendus incidunt iste vel nobis.
williamboman,William Boman,Kalmar,Teacher, adult education,Illo in nam atque voluptas quae beatae quas. Iure recusandae fugiat harum ipsum. Dolorem vero officia voluptatum culpa commodi beatae.
signesvahn,Signe Svahn,Mölndal,Buyer, retail,Quod temporibus quisquam labore. Tenetur tempore nobis excepturi doloremque dolorem illum temporibus. Beatae cupiditate velit optio laborum excepturi culpa molestiae nulla. Ratione dignissimos magnam iure aspernatur maxime nihil.
brittamarklund,Britta Marklund,Örebro,Engineer, land,Odio ad iure non nobis fugit veritatis. Nihil rerum dolorem a labore perspiciatis doloribus quae modi. Sequi itaque iusto nostrum facere quia blanditiis assumenda. Ipsam ipsum ut ad voluptatem culpa reiciendis.
sirirasmusson,Siri Rasmusson,Trelleborg,Sales executive,Ducimus aperiam maiores reprehenderit provident. Facere sed nesciunt quisquam nemo necessitatibus neque. Eaque maxime dolores fugit eum molestias consequatur soluta. Neque impedit qui assumenda eius nostrum cupiditate quia. Ipsam esse explicabo voluptate perferendis amet officia id.
ellafrisk,Ella Frisk,Kalmar,Museum/gallery curator,Minima assumenda dolores tempora. Exercitationem accusantium consequatur dolorem. Voluptates possimus eaque cumque tenetur nam accusamus nam maxime.
marie-louisegöransson,Marie-Louise Göransson,Nyköping,Social worker,Provident fugit voluptatibus velit numquam deleniti. Animi odit porro laboriosam tempora non fuga. Illum quae non vitae ratione similique suscipit libero. Perferendis commodi odit earum commodi minus.
jangranath,Jan Granath,Falun,Rural practice surveyor,Id perferendis itaque consectetur neque praesentium. Quibusdam cupiditate atque eum. Libero hic possimus quam quibusdam est reiciendis. Quod fugit facilis voluptatem autem.
tyrabergsten,Tyra Bergsten,Borlänge,Minerals surveyor,Maxime ea sit repellendus eum praesentium praesentium expedita. Voluptas impedit amet rerum iste commodi. Saepe ex earum animi.
ludvigmoberg,Ludvig Moberg,Södertälje,Museum/gallery exhibitions officer,Eaque accusantium molestias at dolores. Cumque illum aspernatur odio atque a. Iusto accusamus rem deleniti laboriosam provident.
matsknutsson,Mats Knutsson,Luleå,Ship broker,Vero omnis voluptatum fugiat ea reprehenderit. Atque adipisci minus deleniti. Blanditiis doloribus laboriosam voluptatum provident. Asperiores repellat quidem atque quos repellendus consectetur veritatis.
editågren,Edit Ågren,Jönköping,TEFL teacher,Maxime saepe inventore velit recusandae maiores voluptates ad labore. Dolore dolores nobis natus iure ea ex nulla. Molestiae magni molestiae possimus voluptate. Repellat illo eos ex sint inventore. Nam molestias optio earum facere cupiditate aspernatur.
karinsöderqvist,Karin Söderqvist,Västerås,Industrial buyer,Vel ex dolorum molestiae enim. Eum aut deserunt animi quia velit nesciunt alias. Consequatur perspiciatis nisi qui asperiores eligendi distinctio labore. Itaque aut officia odit vero.
siribergström,Siri Bergström,Karlskoga,Ophthalmologist,Aut sapiente velit nemo. Debitis officia repellendus rerum qui earum totam qui numquam. Nam provident quasi provident magnam dicta quaerat. Molestias quis repellendus quod quas saepe vitae. Porro nostrum laborum asperiores fugiat placeat.
tagebackman,Tage Backman,Gävle,Media planner,Voluptatum eum recusandae asperiores iure corporis sed facilis. Reprehenderit ratione vero omnis repudiandae enim quidem quasi. Odit mollitia atque officiis laboriosam ipsam consequuntur. Recusandae est quam sunt voluptatem.
svanteahlström,Svante Ahlström,Trollhättan,Presenter, broadcasting,Eaque suscipit porro tempore. Ad officia recusandae illo tempore. Eveniet adipisci explicabo cum voluptatem sit animi.
ottobengtsson,Otto Bengtsson,Borås,Biochemist, clinical,Sint esse et dignissimos repellendus nesciunt doloremque consequuntur totam. Error deserunt possimus maiores cupiditate maxime libero illum. Nemo sed ea quasi impedit magnam eveniet tenetur.
gertrudkarlström,Gertrud Karlström,Karlskoga,Ecologist,Possimus ea explicabo unde ullam mollitia quidem soluta. Fugit laboriosam deserunt quis deleniti.
ellabolin,Ella Bolin,Borlänge,Architect,Ratione aperiam debitis mollitia deleniti voluptate impedit perspiciatis. Debitis ipsa adipisci iusto ab rem laudantium alias. Rerum ad exercitationem itaque occaecati debitis doloremque beatae.
teodorström,Teodor Ström,Luleå,Financial manager,Beatae sequi temporibus nobis doloremque. Ipsa repudiandae tenetur laborum officia sit tempore in. Odit similique reiciendis aliquam iste repellat sint vel. Est dignissimos ad totam.
beritemilsson,Berit Emilsson,Karlskoga,Psychologist, occupational,Voluptatibus nam reiciendis voluptatum ipsum aperiam tempore tempora. Quae possimus iste omnis suscipit error eaque. Neque doloremque quod nisi porro voluptatibus consectetur nam. Assumenda ducimus aspernatur rem exercitationem rerum.
sonjaekstrand,Sonja Ekstrand,Västerås,Administrator,Quisquam voluptates excepturi eius repudiandae corporis quos quaerat. Praesentium quis nihil vel voluptas officia. Voluptatum excepturi eligendi pariatur nesciunt ratione cupiditate impedit.
birgittahjalmarsson,Birgitta Hjalmarsson,Malmö,Geographical information systems officer,Minima dicta saepe velit eius enim. Aperiam aspernatur eaque fuga deleniti tenetur voluptatem. Deleniti corrupti eius laudantium sequi voluptas culpa velit facilis.
ebbabohman,Ebba Bohman,Helsingborg,Race relations officer,Eveniet enim ipsa quos rem ipsum. Numquam nobis itaque pariatur quibusdam. Ipsa labore officiis quos. Numquam mollitia nostrum vitae est eaque. Commodi voluptatibus corrupti repudiandae.
björnpalm,Björn Palm,Uddevalla,Writer,At excepturi accusantium aliquid animi accusantium necessitatibus voluptate ratione. Recusandae quaerat error voluptatum saepe porro molestiae ad dicta. Mollitia esse sequi et amet. Dignissimos dolor voluptatem eligendi doloribus iste laborum maiores a.
jeanettewestberg,Jeanette Westberg,Halmstad,Best boy,Facere consequuntur fugiat aliquid aliquam dolor quisquam accusamus. Doloribus quasi aspernatur commodi accusamus voluptates magnam eaque dolorum. Voluptates ab omnis architecto maxime iste. Unde earum itaque necessitatibus nihil earum dignissimos sed.
gerhardnorlin,Gerhard Norlin,Göteborg,Museum/gallery exhibitions officer,Saepe deleniti quod totam quas. Commodi temporibus dignissimos unde voluptas cupiditate. Debitis magni sapiente necessitatibus sed maiores at harum tenetur. Natus adipisci iste minus recusandae itaque.
editnorman,Edit Norman,Växjö,Research officer, trade union,Impedit officia doloremque corporis libero eligendi quasi totam ab. Adipisci magnam quibusdam provident impedit omnis minus. Quisquam sint amet optio voluptatum quidem aperiam repellendus ipsa. Doloremque laborum reiciendis pariatur ullam ipsum quas eum.
eskilsjölund,Eskil Sjölund,Varberg,English as a foreign language teacher,Delectus praesentium cumque rerum excepturi neque eos modi. Consequuntur laboriosam dolore occaecati officiis. Eum quisquam minima alias et.
jan-erikwallgren,Jan-Erik Wallgren,Jönköping,Ecologist,Nam dicta cupiditate fugiat numquam sequi. Perferendis nihil nesciunt eos iusto odit. Eveniet placeat voluptas sit earum numquam.
rogerbyström,Roger Byström,Göteborg,Radio producer,Corrupti optio iste doloribus eius eveniet. Sed cumque eum officiis aperiam aperiam qui possimus. Quod modi quas ea esse. Nisi dolore voluptate impedit itaque a.
majwestin,Maj Westin,Södertälje,Passenger transport manager,Nam laboriosam consequuntur esse maiores ut asperiores mollitia. Mollitia beatae quidem debitis corrupti excepturi sint. Magni consequatur consequatur odit provident iste.
stefanboman,Stefan Boman,Växjö,Investment banker, corporate,Quod non molestiae ipsa velit. Debitis quis culpa recusandae totam doloremque vero ipsa id. Libero qui fugit ipsa iure laudantium. Necessitatibus totam sit quaerat rem quas maiores nobis.
egonrehn,Egon Rehn,Helsingborg,Television camera operator,Aliquam possimus porro quis non sequi. Officia qui laborum nulla qui dolore. Illum nam omnis tempora nobis nostrum officia velit. Quam voluptas placeat itaque.
bertalind,Berta Lind,Uppsala,Scientist, marine,Perspiciatis voluptate iste eveniet suscipit sint. Nobis voluptatum nihil veniam beatae a fuga autem. Necessitatibus tenetur illum quis itaque ex provident ipsa. Distinctio incidunt veniam voluptatem consequatur ex enim sequi corporis.
linnéawestin,Linnéa Westin,Östersund,Amenity horticulturist,In voluptatum similique minus accusantium praesentium nemo expedita. Aspernatur expedita illum doloremque eum. Magni nulla unde repudiandae enim quae. In dolor nostrum unde occaecati. Illum odit soluta dolores.
carinasvahn,Carina Svahn,Skellefteå,Communications engineer,Quaerat officia optio totam tenetur numquam. Molestias ad reprehenderit nobis temporibus nam dolores debitis. Voluptates consequatur debitis dignissimos quisquam officia. Architecto atque vero voluptatum adipisci.
emilnordström,Emil Nordström,Sundsvall,Designer, furniture,Architecto et cum nostrum voluptates eligendi. Accusantium ratione voluptatum asperiores magni amet. Sit magnam aliquam ea maiores vel voluptates quam. Magni repellat voluptates debitis dolore quo eos.
alfbackman,Alf Backman,Borlänge,Textile designer,Itaque optio veritatis accusantium incidunt porro amet voluptates enim. Reprehenderit exercitationem natus quia veritatis. Sed atque dicta atque rerum. Saepe quo ullam voluptate itaque.
amandalarsson,Amanda Larsson,Gävle,Accountant, chartered management,Hic nemo quaerat tempora libero sint dicta in. Laudantium esse unde sit minus inventore velit assumenda nesciunt. Rerum atque cupiditate voluptas consequuntur. Enim tempore iusto enim eius expedita distinctio suscipit.
östensvärd,Östen Svärd,Borlänge,Agricultural consultant,Aliquam voluptates consectetur ipsam vitae ad pariatur consequatur. Cupiditate autem ex laboriosam veniam quae sunt. Quas odio et deleniti autem. Ea ut laborum magnam ex facilis repudiandae neque.
danielhult,Daniel Hult,Borlänge,Copy,Quod facere a nesciunt dolorum. Velit quam voluptates voluptas inventore temporibus natus.
tordandreasson,Tord Andreasson,Alingsås,Communications engineer,Aliquid est possimus maxime aliquam rem expedita non. Blanditiis fuga necessitatibus alias voluptas. Modi fugit at sed est tempore ea amet repudiandae. Voluptas sapiente nesciunt sit ducimus quaerat eos laboriosam.
leifvestin,Leif Vestin,Jönköping,Engineer, technical sales,Officia dolore illum placeat ab. Nisi ut pariatur quasi similique praesentium dolores rem. Maiores pariatur amet possimus cupiditate odit esse. Amet inventore tempora fugiat at rem.
carinaståhl,Carina Ståhl,Karlskrona,Scientist, research (maths),Dolor corporis totam sequi adipisci numquam ipsam omnis. Odio exercitationem quisquam animi a. Iusto velit doloremque quasi dolores eius est. Nesciunt mollitia ducimus voluptate sapiente aut. Sit ratione rem suscipit sapiente tempore hic nesciunt.
leonardjakobsson,Leonard Jakobsson,Jönköping,Trade union research officer,Dicta ullam sequi adipisci aut laboriosam provident corporis. Ipsa animi earum sint dolore. Perspiciatis libero dolor doloribus voluptas. Culpa non porro provident. Officia quidem sed at quaerat autem.
linneaanderberg,Linnea Anderberg,Örebro,Orthoptist,Quo sed minus ratione quaerat. Porro alias libero corrupti. Praesentium ipsam necessitatibus sint quasi odio.
gun-brittekström,Gun-Britt Ekström,Alingsås,Sports therapist,Quae neque unde maxime quo delectus recusandae placeat libero. Iusto impedit ratione error esse quisquam recusandae commodi doloremque. Laborum cumque praesentium nemo quasi mollitia.
alexanderjakobsson,Alexander Jakobsson,Södertälje,Journalist, broadcasting,Officiis veritatis ex quod. Cum repellendus molestiae dolorum officiis. Non aliquid voluptatum quam earum nesciunt expedita nostrum. Quisquam corrupti error excepturi. Error iure voluptatibus mollitia explicabo eum blanditiis porro aliquid.
götarosengren,Göta Rosengren,Trollhättan,Agricultural engineer,Enim ipsum minima occaecati id beatae minima culpa. Aliquid fuga inventore saepe laudantium. Maxime enim delectus quia excepturi. Blanditiis fugiat quasi sapiente laborum quibusdam commodi consequuntur.
sörendahlström,Sören Dahlström,Sandviken,Surveyor, commercial/residential,Nostrum voluptatum vel saepe vero ipsa corrupti maxime. Odio in ex laudantium et debitis.
henrikselin,Henrik Selin,Borås,Nurse, adult,Provident in odio quo pariatur doloribus iste. Eos sapiente sit nihil culpa sint ad quia saepe. Facilis magnam explicabo sequi provident cumque minus. Doloremque ullam mollitia fugit veritatis numquam.
huldadahlén,Hulda Dahlén,Eskilstuna,Investment banker, corporate,Inventore cum ratione et cupiditate modi vero. Ipsam eum molestias unde eligendi. Aliquam iure officiis neque deleniti eveniet.
torebäck,Tore Bäck,Skellefteå,Optician, dispensing,Quisquam perspiciatis doloribus nesciunt nesciunt autem quos quas id. Perferendis accusamus possimus esse consequuntur dolorum praesentium aut. Magni eius in aperiam mollitia.
alexanderbergstrand,Alexander Bergstrand,Karlstad,Publishing copy,Natus amet suscipit praesentium repudiandae debitis illum. Doloremque quaerat ipsa explicabo tempore. Dolore commodi maxime at maiores totam possimus voluptatibus. Neque ipsam autem ducimus rerum.
fritiofwallin,Fritiof Wallin,Uppsala,Nutritional therapist,Numquam nesciunt ex illum pariatur. Atque natus provident eveniet voluptate perspiciatis molestias. Maiores alias provident eveniet a fugiat magni.
gunnarkarlsson,Gunnar Karlsson,Umeå,Teacher, music,Quasi quisquam voluptate ducimus ab. Temporibus neque soluta dolorem. Qui quas exercitationem excepturi accusamus.
manfredelofsson,Manfred Elofsson,Norrköping,Sub,Ipsum temporibus alias reiciendis reprehenderit. Quas temporibus non voluptatibus hic expedita quidem cupiditate. Nihil esse sit eveniet ipsa officiis hic. Sit expedita dolor quidem quasi.
irisroth,Iris Roth,Kalmar,Museum/gallery exhibitions officer,Molestias rem nemo vitae debitis perferendis eligendi dolorem. Ad distinctio temporibus voluptates porro minus aliquam. Officia explicabo deserunt sunt veniam velit asperiores. Sunt corporis iste veniam exercitationem cumque corrupti.
inga-brittåman,Inga-Britt Åman,Alingsås,Astronomer,Accusantium quia dolorum ducimus assumenda culpa aperiam. Ex molestiae assumenda quibusdam doloribus. Sed vero necessitatibus similique in amet ipsum. Labore est ratione quia mollitia voluptatum eum.
gretahagström,Greta Hagström,Karlskoga,Psychotherapist, dance movement,Eveniet fugit quis provident minus voluptatibus autem culpa. Id perspiciatis modi beatae corporis consectetur enim. Minus in excepturi nihil molestiae dignissimos incidunt qui.
britatorstensson,Brita Torstensson,Gävle,English as a foreign language teacher,Minima consequuntur recusandae quibusdam perferendis quas sapiente. Quo explicabo saepe eum nostrum. Officiis dolores sequi omnis nemo ea. Provident veritatis maxime placeat nobis corporis quidem consectetur.
ingegerdståhl,Ingegerd Ståhl,Eskilstuna,Oncologist,Temporibus architecto sit quaerat est esse soluta deserunt quasi. Rem exercitationem pariatur amet accusantium nihil. Neque sequi molestiae optio possimus dolorem.
johannespetersson,Johannes Petersson,Norrköping,Corporate treasurer,Eum asperiores eius nobis excepturi qui quia pariatur. Omnis eligendi libero corrupti voluptatibus eaque rem. Ut nihil quas harum illum. Eius facilis error quae perspiciatis fugiat fugit.
edvardhöglund,Edvard Höglund,Landskrona,Administrator, education,Perspiciatis facilis quis voluptatem non consequatur alias. Laudantium natus nisi voluptatum ipsum pariatur reiciendis. Ipsa dolores sit pariatur laborum. Labore inventore unde inventore vel praesentium suscipit ipsam neque.
elofholst,Elof Holst,Borås,Magazine journalist,Molestiae earum sint praesentium. Repellendus eligendi est provident illum. Deserunt facere eos totam tempora cum voluptas.
ingerlundgren,Inger Lundgren,Mölndal,Financial controller,Dolore sed quod pariatur veniam amet omnis hic asperiores. Molestiae autem cum porro voluptatum. Assumenda reiciendis dignissimos suscipit eos iure. Libero unde voluptatum neque possimus voluptas fugit nemo.
göstastorm,Gösta Storm,Lidingö,Designer, television/film set,Nisi eveniet numquam voluptatibus qui nostrum. Corrupti ab ipsum placeat. Saepe expedita sed suscipit placeat fugiat.
evaldwallin,Evald Wallin,Uddevalla,Dietitian,Rem minima culpa architecto dolorum sed. Ut soluta modi ipsum architecto. Sequi explicabo doloremque pariatur minima in. Est expedita provident dolorum molestiae repellat optio saepe.
stureturesson,Sture Turesson,Borlänge,Insurance broker,Voluptatibus magnam nesciunt id a. Nihil quas mollitia natus dolor ea nostrum. Laborum minus quod deleniti sint maxime aliquid.
margaretahjalmarsson,Margareta Hjalmarsson,Trelleborg,Television/film/video producer,Tempora illo et consequuntur. Nisi perferendis atque tenetur deleniti. Officiis alias rerum nihil corporis.
stefanwerner,Stefan Werner,Stockholm,Aeronautical engineer,Nulla non nisi sunt repellat exercitationem tempora. At pariatur nostrum aspernatur corrupti consequuntur vero deserunt. Dolor a in rem aut ratione soluta ipsum. Vel provident velit blanditiis itaque.
solveiglindquist,Solveig Lindquist,Halmstad,Legal secretary,Ratione earum repellat impedit. Iusto optio quod inventore voluptatem quod. Numquam autem autem odit aspernatur. Nobis ad dolorum laborum.
elisabethäggström,Elisabet Häggström,Borlänge,Solicitor,Pariatur nesciunt atque dolorum voluptatum. Beatae ab porro alias adipisci dicta voluptatum natus. Autem aperiam delectus ratione repellat. Repellendus placeat error deleniti voluptate accusamus corrupti.
konradgabrielsson,Konrad Gabrielsson,Lidingö,Air broker,Vel nesciunt voluptatem sunt maxime nobis soluta autem quod. Voluptas quia beatae voluptas tenetur commodi impedit ab.
ronnylundblad,Ronny Lundblad,Västerås,Economist,Exercitationem nemo porro mollitia maiores vel veritatis. Explicabo quibusdam autem fugiat modi quam libero perspiciatis voluptate. Debitis quaerat quod et corporis ipsam eaque id. Ullam debitis inventore suscipit dolorem numquam.
sylviafrisk,Sylvia Frisk,Trelleborg,Surveyor, minerals,Ab dicta adipisci quos. Inventore fuga neque assumenda. Sint repellendus occaecati dolorum vero ab autem.
augustaåström,Augusta Åström,Uppsala,Research scientist (medical),Necessitatibus aspernatur magni qui harum repellat quod ea. Eaque possimus labore blanditiis reiciendis in iure. Est commodi vel mollitia officiis rerum odio ut nesciunt.
brorsjöberg,Bror Sjöberg,Örebro,Licensed conveyancer,Necessitatibus illum facilis aliquid accusamus distinctio atque repellendus a. Tenetur ea perferendis debitis voluptatem.
fritzaugustsson,Fritz Augustsson,Falun,Medical secretary,Expedita odio quas error ratione fuga. Voluptas aperiam officiis rerum odit. Dicta odio aspernatur repellendus debitis tenetur deserunt sit.
olleengman,Olle Engman,Ängelholm,Psychologist, sport and exercise,Perferendis repellat praesentium molestiae architecto ipsum ea. Repellendus unde quisquam aperiam dolorem hic expedita. Accusamus doloremque eaque non distinctio ut voluptate.
amaliabackman,Amalia Backman,Lidingö,Learning disability nurse,Cumque a laborum ullam expedita eveniet repudiandae vitae. Inventore officia occaecati fugit praesentium cumque nobis veniam. Cupiditate repellat quo voluptate. Veniam dolores accusamus accusantium veritatis assumenda harum modi.
brorhall,Bror Hall,Lidingö,Engineer, maintenance (IT),Dolorem occaecati illo praesentium. Maiores exercitationem atque doloribus sequi. Laboriosam commodi aliquid dolore necessitatibus exercitationem.
