Username,Name,City,Job,Bio
idaahlberg,Ida Ahlberg,Umeå,Restaurant manager, fast food,Voluptatum officiis consequuntur perferendis ipsam quae assumenda. Doloribus quo maxime illum occaecati amet. Qui tenetur maiores omnis temporibus aliquam aperiam dignissimos.
emilhall,Emil Hall,Umeå,Producer, television/film/video,Quia reprehenderit neque quia assumenda. Quod optio recusandae nam optio voluptatem. Eius ea voluptates iusto exercitationem nulla.
pärsöderholm,Pär Söderholm,Linköping,Doctor, general practice,Adipisci molestias velit illo quaerat beatae. Laboriosam vitae sed cupiditate. Ab omnis distinctio inventore cupiditate eum. Neque unde error consequuntur eos rerum quis doloribus.
iréneåsberg,Iréne Åsberg,Alingsås,Medical physicist,Facere ratione nam est nesciunt. Nobis ipsum fuga aspernatur tempora sint incidunt. Occaecati exercitationem vitae perferendis omnis.
arnoldmöller,Arnold Möller,Landskrona,Geologist, wellsite,Fugiat praesentium ex dicta nobis nobis natus. Maiores numquam ea alias ratione necessitatibus modi. Optio ullam magni hic esse. Quasi perspiciatis dicta temporibus possimus. Pariatur sed dolor vero aspernatur facilis quae.
dagmarsjölin,Dagmar Sjölin,Skellefteå,Ranger/warden,Libero quaerat officia assumenda libero amet odit. Molestias facilis officiis nam ea consequuntur reprehenderit. Temporibus nisi omnis atque optio.
huldaalfredsson,Hulda Alfredsson,Kalmar,Estate manager/land agent,Ratione vero vero commodi rem earum. Suscipit fuga repellat consequuntur soluta nisi commodi modi.
dagnyolovsson,Dagny Olovsson,Gävle,Therapist, sports,Mollitia quia magni eius vero minima iusto atque praesentium. Libero a consequatur accusamus accusantium ducimus excepturi. Illo nobis temporibus nisi iure illo assumenda iure. Molestias debitis est necessitatibus nostrum dolorem optio quia.
williamåkerström,William Åkerström,Borlänge,Accountant, chartered certified,Cum magni natus veniam esse. Enim vitae rem dolores ducimus deserunt. Voluptatum laboriosam vel modi cupiditate.
gunhildholmström,Gunhild Holmström,Östersund,Investment banker, operational,Officiis labore eum nulla. Dicta reiciendis tempore officiis nulla excepturi unde. Tenetur facilis pariatur labore veniam.
agnessöderholm,Agnes Söderholm,Södertälje,Administrator, sports,Eligendi illum repellat pariatur nesciunt porro. Quas ut atque nesciunt quo eius numquam nihil. Nesciunt accusamus dolorum a voluptatibus dolor accusantium officiis minus.
gunvorgöransson,Gunvor Göransson,Varberg,Engineer, electrical,Unde voluptates architecto eaque dolor vitae tempore consequuntur nihil. Ullam iusto cumque dolorem. Illo autem velit earum dignissimos vel sit ipsa.
ingalillbergström,Ingalill Bergström,Alingsås,Occupational psychologist,Nostrum alias dolorem nemo libero iste ullam. Amet magnam vero delectus officia harum debitis animi. Fugit minus cumque ipsum modi nemo sunt. Aliquid necessitatibus commodi voluptates.
hugoholmkvist,Hugo Holmkvist,Skövde,Emergency planning/management officer,Incidunt voluptate dolores dicta libero. Quia laboriosam nisi porro et fugiat harum. Voluptate qui nisi nostrum numquam sunt eos in quibusdam. Earum vitae fugit pariatur laborum iste vel. Quaerat hic aut dolorum tenetur.
karlekström,Karl Ekström,Lidingö,Ceramics designer,Iusto molestias suscipit soluta tempore. Quia optio quo minima ducimus minus est. A consequatur velit earum minus quos occaecati. Tempora quam mollitia voluptas sed.
jonaslundell,Jonas Lundell,Helsingborg,Clinical molecular geneticist,Facilis reiciendis vitae dignissimos architecto veritatis rem. Asperiores inventore quis dolores cum iure eum facilis in. Aliquid neque fuga id officia ea modi. Magnam rerum consequatur libero minus quis sed cumque.
peterturesson,Peter Turesson,Örnsköldsvik,Amenity horticulturist,Iste illo hic enim ab eius. Dolores molestiae delectus optio repellendus. Aliquid ratione minus sit molestias dolore quod deleniti autem. Culpa placeat architecto mollitia magnam praesentium esse atque.
klasjensen,Klas Jensen,Östersund,Toxicologist,Eum placeat eveniet tenetur velit necessitatibus. Occaecati praesentium voluptatibus delectus adipisci in nostrum architecto possimus. Blanditiis occaecati ut quae blanditiis. Ipsa pariatur quam facilis aliquam itaque nobis. Culpa voluptatum harum at nemo voluptate debitis voluptatem.
gudrunerlandsson,Gudrun Erlandsson,Göteborg,Legal secretary,Vitae cupiditate dicta atque reiciendis dicta tenetur. Accusantium ad alias possimus ad. Alias consequuntur voluptates debitis eum molestiae ut veritatis debitis.
gerdaekström,Gerda Ekström,Karlskrona,English as a foreign language teacher,Saepe odio harum harum porro. Quia dolores eum nemo dicta itaque necessitatibus autem nihil. Quaerat non non error exercitationem numquam eos.
annikasjöqvist,Annika Sjöqvist,Nyköping,Journalist, magazine,Vero minus eum vero quibusdam fugit. Facilis cumque provident non fugiat.
oliviawallin,Olivia Wallin,Piteå,Chiropractor,Distinctio sequi iste assumenda assumenda ad. Tenetur a nam repellendus fugiat magnam. Accusamus iste accusantium quas iure earum expedita architecto. Ex quas qui nulla non.
sveabroberg,Svea Broberg,Alingsås,Ophthalmologist,Eligendi inventore asperiores ducimus eius enim sequi. Reiciendis reiciendis soluta doloremque magni soluta maiores. Delectus voluptatem commodi voluptas.
evelinaviberg,Evelina Viberg,Falun,Retail manager,Et explicabo quia vero animi aspernatur natus. Natus occaecati cumque sunt iure aspernatur. Minima culpa explicabo et iusto praesentium iusto atque. Earum sed neque sunt nam.
tagewestberg,Tage Westberg,Kalmar,Mudlogger,Dolor dignissimos et alias deserunt voluptatem eum. Dolore accusantium veritatis nobis fuga.
alflantz,Alf Lantz,Örebro,Best boy,Eum ea odit maiores sed autem id. Rerum laborum temporibus numquam at et. Ab tempore tempora ratione corrupti quae a.
jenshedlund,Jens Hedlund,Örebro,Embryologist, clinical,Expedita sit illo facilis a perspiciatis laboriosam assumenda. Ratione temporibus reprehenderit quod aliquid eligendi perspiciatis. Ea soluta doloremque alias et aut quaerat repudiandae sed. Accusamus deserunt fugiat molestiae rem quod cum alias.
sonjaöberg,Sonja Öberg,Nyköping,Careers adviser,Optio quo minus esse incidunt ratione id. Facilis natus officiis dolor blanditiis. Consequuntur similique dolor eaque sint dolorum quisquam.
andreasandersson,Andreas Andersson,Sundsvall,Building services engineer,Quam sed provident laudantium alias modi. Mollitia inventore perferendis dolorem eius quasi sapiente dolores sit. Recusandae ipsum exercitationem amet repudiandae vero.
elsypihl,Elsy Pihl,Karlstad,Mental health nurse,Facere explicabo quo ut nemo possimus. Illo dolorem voluptatem eveniet mollitia eligendi laudantium voluptate. Magnam minima laborum ipsa.
ingvarmalm,Ingvar Malm,Mölndal,Research officer, trade union,Molestias officiis perspiciatis animi illum est laboriosam. Velit ipsam doloremque ad inventore dolorum nihil nihil blanditiis.
sunelundholm,Sune Lundholm,Östersund,Statistician,Aliquid aspernatur quo consectetur. Impedit facere voluptates mollitia quisquam dolorem architecto.
hilleviandreasson,Hillevi Andreasson,Ängelholm,Designer, fashion/clothing,Excepturi perferendis veniam ut maiores corporis iure repellendus. Aspernatur dolores reiciendis quam vero. Maiores culpa facilis ipsa fugit qui magnam autem.
hildingalexandersson,Hilding Alexandersson,Trelleborg,Engineer, broadcasting (operations),Tenetur minima nesciunt iure omnis officia deleniti mollitia. Deleniti quaerat dolore occaecati veritatis vitae. Ducimus impedit corporis blanditiis quidem aliquam.
ludvigsvärd,Ludvig Svärd,Falun,Scientist, physiological,Corrupti sunt cum accusantium quisquam atque ullam quos. Similique pariatur ducimus rerum quas cum ratione velit consequatur.
hillevieklund,Hillevi Eklund,Linköping,Art therapist,Illo nisi autem dolor consequuntur debitis. Laborum placeat tenetur nulla deleniti ipsa ea. Amet quos dolorem quas cum error porro optio. Voluptatem voluptatibus accusamus autem quod reprehenderit possimus neque.
jennyekberg,Jenny Ekberg,Falun,Therapist, horticultural,Quas neque quisquam molestias illo iste ut est. Aut deserunt dicta dolor illum. Labore soluta autem perspiciatis facilis facere earum.
alexanderöberg,Alexander Öberg,Trelleborg,Geneticist, molecular,Cumque eligendi nostrum esse consequuntur. Accusamus fugit molestias tempora optio quos.
pärsjölund,Pär Sjölund,Mölndal,Higher education careers adviser,Excepturi deleniti nostrum natus sed. Eum corporis deserunt voluptas odio.
mattiasnordgren,Mattias Nordgren,Örnsköldsvik,Information systems manager,Numquam reiciendis facilis sed consequatur soluta praesentium voluptatum molestias. Blanditiis quod tempora fugiat. Accusamus reiciendis doloribus eos. Voluptate libero possimus soluta aspernatur.
danwesterlund,Dan Westerlund,Östersund,Child psychotherapist,Dolor nisi corporis unde dolorum dolor corporis. Reprehenderit ut quis praesentium consequuntur atque dolor. Vel nesciunt quibusdam praesentium quisquam est blanditiis architecto.
solveigrobertsson,Solveig Robertsson,Alingsås,Electrical engineer,Est repellat amet impedit deserunt similique laudantium laudantium. Architecto similique occaecati quasi inventore accusamus animi. Quidem sequi ut mollitia velit.
georgandersson,Georg Andersson,Södertälje,Agricultural consultant,Molestiae placeat a quaerat placeat. Dolore illum sunt saepe atque libero. Dolor a qui magni ad eaque praesentium dolorem.
dagmarasp,Dagmar Asp,Trelleborg,Armed forces technical officer,Possimus ratione explicabo ipsum ex aspernatur fuga error quis. Cupiditate optio doloribus quasi nobis rerum sapiente quibusdam omnis. Corporis voluptatibus officia labore suscipit dolor labore perferendis reiciendis.
charlottedanielsson,Charlotte Danielsson,Lund,Recruitment consultant,Voluptas autem illo vel quidem. Libero non eveniet recusandae dolorem ut ex. Est cumque cupiditate provident sequi. Laudantium aperiam commodi sequi quae excepturi.
mariananordberg,Mariana Nordberg,Halmstad,Estate agent,Beatae laborum earum nesciunt tempora iure. Doloremque sit nesciunt delectus ex quidem inventore possimus. Temporibus tempore ullam voluptates blanditiis quibusdam quam impedit.
annanyström,Anna Nyström,Stockholm,Advertising art director,Error mollitia nesciunt laborum vero corporis adipisci. Dolor ut voluptate blanditiis at atque laborum aperiam reprehenderit. Voluptate inventore quaerat molestias vero provident. Tempore labore cupiditate sunt corporis. Placeat quod vero dolores iste sed molestias.
irisrosenqvist,Iris Rosenqvist,Trelleborg,Retail buyer,In alias rerum repellat autem. Hic voluptatem iure commodi quis maiores dolorem optio cumque. Sunt esse excepturi laboriosam pariatur ipsam quos voluptas.
karlrosenqvist,Karl Rosenqvist,Borås,Paramedic,Minima atque fugiat asperiores dicta mollitia omnis. Architecto sunt inventore ipsum dicta dignissimos. Nulla aut iusto labore aspernatur repudiandae soluta nulla.
arturnordlund,Artur Nordlund,Södertälje,Engineer, automotive,Voluptas minus ipsa ipsum voluptatibus optio accusantium a dicta. Et amet pariatur amet ex. Assumenda minima nisi amet sapiente voluptate.
knutpalmqvist,Knut Palmqvist,Varberg,Geophysical data processor,Amet sapiente aperiam rerum nobis laborum consequatur. Ea blanditiis aut voluptates veritatis. Maiores magni neque commodi temporibus aspernatur vel pariatur. Nihil est quam perspiciatis enim occaecati nobis.
irénelindqvist,Iréne Lindqvist,Malmö,Technical sales engineer,Aperiam est expedita adipisci provident similique expedita. Impedit voluptatibus distinctio ex eaque numquam cupiditate. Impedit repudiandae porro libero consequuntur maxime officiis. Itaque eveniet sapiente iusto quia repellat dignissimos facilis.
gretanygren,Greta Nygren,Karlstad,Cytogeneticist,Velit repellat perferendis aliquam possimus consequatur rerum tenetur. Incidunt in quasi blanditiis minus quod. Assumenda velit quas natus earum.
valdemarbolin,Valdemar Bolin,Alingsås,Race relations officer,Repudiandae voluptate perferendis rerum. Architecto consequatur dolorum adipisci excepturi explicabo. Culpa quia iste blanditiis eligendi. Architecto et recusandae sed ratione dicta quia.
britagöransson,Brita Göransson,Helsingborg,Chemist, analytical,Id totam consectetur tempore dolores inventore. Saepe cum autem ipsam autem odio accusamus culpa possimus. Placeat rerum fuga quaerat fuga.
börjealmgren,Börje Almgren,Stockholm,Advertising copywriter,Ex cum quidem laboriosam corrupti eveniet tenetur sint. Deserunt rem iure mollitia dicta repudiandae. Nesciunt numquam optio deleniti consequatur alias. Veritatis beatae impedit quam.
ann-marihult,Ann-Mari Hult,Jönköping,Programme researcher, broadcasting/film/video,Consectetur fuga alias nisi odit tempore. Sint repellat porro repellendus omnis porro est architecto illo. Illo iste omnis eius. Corporis necessitatibus nostrum debitis facilis.
lisawallgren,Lisa Wallgren,Sundsvall,Engineer, structural,Quia saepe dignissimos nisi voluptatum soluta facere aliquid. Nisi dignissimos labore non corrupti. Dicta natus rerum corrupti occaecati dolorum. Natus distinctio vitae error dignissimos excepturi eius.
patrikzetterström,Patrik Zetterström,Eskilstuna,Financial planner,Cumque atque expedita quae error facilis explicabo molestiae. Repudiandae neque quod quas a fugiat inventore odit nulla. Porro alias eos laboriosam. Facere molestias non in aperiam repellendus magni.
lillemoröstman,Lillemor Östman,Sundsvall,Counsellor,Et quaerat id ad dolor enim nostrum. Odit impedit itaque aspernatur sint hic consequatur id. Facere minima accusamus officia qui tempore excepturi.
emanuelroos,Emanuel Roos,Jönköping,Therapist, occupational,Vitae repudiandae quam accusamus assumenda. Corporis adipisci soluta vel autem explicabo unde et officiis. Placeat nemo recusandae similique commodi eveniet. Quo repudiandae eaque rem vero omnis aliquam adipisci.
teodorwall,Teodor Wall,Karlskrona,Data processing manager,Quo assumenda nulla praesentium deleniti non dolores. Nulla eum hic libero quasi. Itaque repudiandae nulla omnis commodi ut esse non consequuntur. Suscipit laborum porro harum pariatur voluptatibus.
ellenengdahl,Ellen Engdahl,Örebro,Conservator, museum/gallery,A et tempora dolorem voluptas blanditiis quo nulla veniam. Voluptatibus tempora ducimus maxime laboriosam magni vel sint. Maiores ratione fuga quaerat perferendis et aliquam quaerat.
leifhellgren,Leif Hellgren,Luleå,Restaurant manager,Cum quis facere aspernatur quis tempore sunt consequatur. Culpa distinctio vel distinctio illo quis. Optio dolorum assumenda quidem illum. Asperiores corporis nulla facilis illum quas voluptate provident.
veranyström,Vera Nyström,Karlskoga,Broadcast engineer,Possimus aut nesciunt at ducimus. Magnam quis libero porro inventore esse. Laudantium consectetur explicabo at impedit laudantium aliquid odit laborum. Ab aliquid eveniet ab atque voluptates natus eius. Nisi enim optio vero officia voluptas laborum.
yvonneholmqvist,Yvonne Holmqvist,Örebro,Catering manager,Quaerat dolore facilis voluptatum unde accusamus earum. Nisi sequi voluptates quae porro qui. Qui minima eligendi praesentium beatae asperiores nesciunt culpa. Laudantium impedit ipsam excepturi nam.
valternordlund,Valter Nordlund,Skellefteå,Lighting technician, broadcasting/film/video,Explicabo eveniet itaque sed cum odit. Repudiandae nobis minus esse totam dignissimos a et. Quo quisquam sed nisi blanditiis consequatur mollitia. Nemo excepturi molestias nostrum excepturi suscipit eos.
signelindfors,Signe Lindfors,Kalmar,Animal nutritionist,Dolor accusantium in quis. Minus quam repudiandae ad porro et natus omnis. In illo earum voluptate officia aspernatur itaque.
alfholmberg,Alf Holmberg,Göteborg,Horticultural consultant,Aperiam quos saepe eius. Accusamus ab adipisci sint reiciendis asperiores quod nemo.
paulinapedersen,Paulina Pedersen,Landskrona,Psychologist, sport and exercise,Debitis cum omnis et sed. Dignissimos assumenda perferendis animi sunt mollitia adipisci. Illo fugit blanditiis vel accusamus eum labore illo. Molestias rem adipisci molestiae.
åsanord,Åsa Nord,Örnsköldsvik,Audiological scientist,Sit delectus sint vel ullam. Vel quis omnis tenetur sit fugiat minima quo numquam. Omnis itaque reprehenderit natus. Suscipit at odit cumque explicabo ad maiores maiores.
manfredboström,Manfred Boström,Uddevalla,Glass blower/designer,Atque dolores hic quos porro fugiat. Esse aspernatur consequuntur assumenda impedit. Hic quo dolorum earum hic.
axellindvall,Axel Lindvall,Karlskoga,Web designer,Totam in optio accusamus ullam ut distinctio fuga. Numquam hic cum animi dicta illo saepe accusantium facere.
elnagustafsson,Elna Gustafsson,Kristianstad,Training and development officer,Libero suscipit necessitatibus accusantium fuga. Non nesciunt aut repellat quo. Aperiam quisquam beatae rem eius eius unde quaerat.
elsaåberg,Elsa Åberg,Ängelholm,Garment/textile technologist,Veniam expedita quidem suscipit molestiae et fugiat veniam. Illo numquam tempora fugiat perferendis. Cum architecto saepe molestias dicta officiis. Nobis eligendi nisi unde.
camillasimonsson,Camilla Simonsson,Västerås,Midwife,Beatae corporis culpa voluptates ex. Molestias dolore error possimus quo. Neque incidunt esse deserunt eius nulla vitae suscipit quibusdam. Deserunt voluptatibus eos commodi doloremque quae enim quia. Nesciunt sequi cupiditate sit sunt.
josefinabäckman,Josefina Bäckman,Falun,Newspaper journalist,Consequuntur iusto velit maiores esse vel autem. Earum voluptatibus aperiam totam sit corporis adipisci. Ea corporis provident voluptas facilis voluptatem error quis. Consequuntur ipsam ratione aliquam totam accusantium.
mikaelek,Mikael Ek,Göteborg,Hydrogeologist,Commodi eligendi culpa voluptate necessitatibus. At vel laborum magni praesentium. Vitae magni magni occaecati perferendis at. Numquam laudantium assumenda veritatis natus veritatis libero eligendi.
marianneasplund,Marianne Asplund,Växjö,Medical physicist,Dolore necessitatibus illum laudantium sequi. Eaque praesentium dolor sunt voluptate mollitia. Natus modi aut necessitatibus molestiae. Esse aspernatur corporis facere suscipit quos.
christinafors,Christina Fors,Lidingö,Commercial/residential surveyor,Fuga expedita nobis similique neque ea. Deleniti doloremque quas doloremque non. At dolore ab nesciunt architecto. Pariatur debitis consectetur sed omnis dolorum architecto.
karlekdahl,Karl Ekdahl,Sundsvall,Field trials officer,Quis veniam ullam minus cumque possimus. Placeat minus odio minima unde. Deserunt et quas praesentium deleniti dolorum ea aliquam. Vel sint ratione culpa blanditiis assumenda placeat et.
gunhildlöf,Gunhild Löf,Östersund,Radiographer, therapeutic,Atque quam alias esse porro excepturi ullam mollitia a. Quod quod assumenda sit quod quae. Earum beatae nam incidunt accusamus quo et.
britavestlund,Brita Vestlund,Uddevalla,Presenter, broadcasting,Facilis nemo sed maiores assumenda voluptas aperiam. Quo autem reprehenderit blanditiis. Nulla neque eos voluptas veniam. Sed cupiditate sequi qui vitae voluptatem tempora consequuntur. Dolores corrupti itaque omnis cupiditate.
haraldnäslund,Harald Näslund,Borlänge,Restaurant manager,Officia soluta voluptas ex officia. Illo dolorum voluptas at. Et repudiandae esse iste at laborum.
patriksjölin,Patrik Sjölin,Lund,Legal secretary,Assumenda incidunt magni ullam iusto. Dignissimos beatae delectus repudiandae nobis culpa consequuntur rem. Aliquam quis accusantium adipisci occaecati non maiores assumenda voluptatem. Illo commodi fugiat ipsum dolor dolorem.
egonbjörklund,Egon Björklund,Norrköping,Journalist, newspaper,Nisi explicabo eos blanditiis assumenda assumenda tempore. Beatae consequuntur aliquam aut dolores natus. Facilis inventore consequuntur dicta debitis. Natus aut iusto dolor eum quia vitae.
adolfrylander,Adolf Rylander,Eskilstuna,Magazine features editor,Dolore facilis dolor voluptatibus dolor deleniti doloremque. Odit quae doloremque nemo assumenda quaerat voluptates labore.
jonnymartinsson,Jonny Martinsson,Borlänge,Personnel officer,Fuga dolores odio fuga dignissimos debitis quis ab. Odit repudiandae reiciendis doloribus omnis eveniet. Possimus id amet ab non saepe dolor expedita cum. Occaecati adipisci illo quaerat error.
tagelundblad,Tage Lundblad,Gävle,Building surveyor,Repellat eaque natus laboriosam ex tempore nisi. Ut molestiae possimus earum. Dolor itaque voluptatibus recusandae. Asperiores minus voluptate blanditiis eos aliquam.
esterstenberg,Ester Stenberg,Uppsala,Solicitor, Scotland,Nemo non accusamus dolore non reiciendis rem sapiente. Voluptatum dolore rerum sint. Odio neque maiores voluptatum ipsa asperiores fugiat. Corrupti aliquid magnam sit.
gunillalindkvist,Gunilla Lindkvist,Lund,Merchant navy officer,Voluptate non quae itaque exercitationem saepe inventore. Inventore quasi quae odio fugit dignissimos. Ducimus animi ratione quis placeat assumenda tempore quis.
yngvepetersson,Yngve Petersson,Borlänge,Insurance risk surveyor,Ducimus impedit explicabo iste rem dolor iste. Inventore perferendis architecto dolor consequuntur ea rerum. Quod quae ullam repellendus inventore aut praesentium.
adolfzetterström,Adolf Zetterström,Borås,Sports therapist,Modi consectetur beatae natus repellendus. Quae error voluptatum excepturi ut veritatis id. Numquam repellendus doloribus iusto eveniet sed dignissimos inventore. Facere quos minima optio hic ex unde fuga optio.
ingemargranath,Ingemar Granath,Kristianstad,Chemical engineer,Aperiam assumenda repellat animi omnis sint maxime. Tenetur rerum quaerat quaerat occaecati magnam molestiae. Consectetur consectetur architecto facilis numquam nam. Voluptatum architecto iusto pariatur laudantium tempore temporibus distinctio.
hillevisvensson,Hillevi Svensson,Eskilstuna,Civil Service administrator,Voluptas sapiente hic porro distinctio. Facilis voluptatum iusto quos mollitia corrupti accusamus consectetur. Quo doloremque quibusdam sed alias expedita maxime modi tempora. Ipsa assumenda ullam labore eius quidem velit illum hic.
susanneedin,Susanne Edin,Ängelholm,Manufacturing engineer,Illum mollitia reiciendis totam rem atque deleniti. Eaque laboriosam qui ad eum rerum dolores eveniet ducimus. Accusamus quisquam debitis tempore ullam asperiores. Suscipit nobis iure sed repellendus ea sed.
ferdinandolsson,Ferdinand Olsson,Malmö,Journalist, magazine,Reprehenderit eum voluptas cum nostrum quod. Maiores ratione temporibus similique reiciendis eius. Corrupti corrupti impedit maiores aut dignissimos porro. Nulla iste fugit id cum.
wilhelmwikström,Wilhelm Wikström,Malmö,Video editor,Vero numquam sint dolore nemo. Facilis minima voluptates harum. Qui aperiam accusamus officia ab enim sapiente.
andreashaglund,Andreas Haglund,Piteå,Engineer, water,Dolores nisi blanditiis omnis. Occaecati tempora accusamus ea repellat quia totam adipisci. Dicta molestias itaque vero commodi eaque a praesentium.
matildaberglund,Matilda Berglund,Kalmar,Interpreter,Vel nemo minima dolor dolorum sequi ex nostrum. Officia voluptatem aut porro. Nesciunt ullam harum quibusdam molestias.
carlhammar,Carl Hammar,Karlstad,Producer, television/film/video,Perferendis quam asperiores illum alias. Sequi eaque velit consectetur non asperiores dicta distinctio provident. Possimus porro quia nesciunt inventore debitis. Mollitia vel dicta voluptate qui.
magdalenabacklund,Magdalena Backlund,Skellefteå,Scientist, physiological,Ipsum natus adipisci odio voluptatibus corporis. Ad ut aliquid nulla. Iste fuga nisi nihil adipisci aliquid eligendi cupiditate et.
maj-brittmoberg,Maj-Britt Moberg,Sandviken,Operations geologist,Vitae quis aliquid iusto ad dolore. Facere dicta nulla facilis et hic. Voluptates magnam necessitatibus natus qui. Perspiciatis molestiae maiores dicta eos sit.
hillevihagström,Hillevi Hagström,Norrköping,Interior and spatial designer,Nobis deserunt accusantium laborum amet ex sit. Necessitatibus sequi vitae natus deleniti. Voluptates ad dicta natus. Animi minus magni occaecati vitae quisquam cupiditate.
erikanord,Erika Nord,Karlstad,Occupational therapist,Sit labore impedit commodi illo totam. Voluptatem inventore culpa esse magnam blanditiis laboriosam. Voluptatem quidem temporibus et corporis distinctio debitis laboriosam. Magni minima cum dolore corrupti.
agneslundell,Agnes Lundell,Södertälje,Rural practice surveyor,Libero repudiandae consequatur voluptatum rem ipsum nobis amet dolores. Molestias et inventore quam suscipit quis magnam iste. Doloribus natus laboriosam eos debitis consequatur. Sequi veniam est deleniti.
tyrasöderberg,Tyra Söderberg,Gävle,Hotel manager,Ipsum blanditiis dolor deserunt soluta alias. Culpa sequi ea optio illo tenetur ex laudantium. Saepe autem doloremque inventore debitis facilis ab quae.
ingegerdåkerlund,Ingegerd Åkerlund,Sundsvall,Engineer, structural,Amet aut veritatis explicabo cumque velit rerum. Harum at voluptatem sed. Explicabo molestias id enim debitis est.
esterbörjesson,Ester Börjesson,Trollhättan,Event organiser,A aliquam reiciendis illo voluptatum commodi temporibus vitae veniam. Dicta officiis non laboriosam eius ullam provident. Alias vitae sequi iusto voluptatem minima placeat. Suscipit doloribus architecto molestias nisi recusandae odio.
olabodin,Ola Bodin,Uppsala,Education officer, museum,Animi saepe itaque excepturi adipisci aspernatur. Praesentium aperiam rerum quos quisquam minima. Architecto quae beatae voluptas veniam. Aspernatur soluta odit dolores maxime quasi tempora illo ipsum.
götenordström,Göte Nordström,Stockholm,Energy engineer,Sit doloremque minima illum eligendi accusantium. Magni quas aut nesciunt sapiente.
urbanivarsson,Urban Ivarsson,Halmstad,Product/process development scientist,Error facere ratione ducimus commodi dignissimos accusantium excepturi. Ipsum accusamus veniam error debitis deserunt consequuntur doloremque. Provident quaerat aperiam libero porro fugiat provident.
